patent_id,title,abstract,assignee,inventor_author,priority_date,filing_date,publication_date,grant_date,result_link,image_link,language,technology_category,publication_year,filing_year
,PROCÉDÉ ET APPAREIL DE PRISE EN CHARGE D'APPLICATIONS D'INTELLIGENCE ARTIFICIELLE (IA) DANS DES COMMUNICATIONS SANS FIL,"
                        ",LENOVO BEIJING LTD [CN]; LENOVO (BEIJING) LIMITED,"ZHANG CONGCHI [CN];  SONI TAPISHA [DE];  LÖHR JOACHIM [DE];  WU LIANHAI [CN]; ZHANG, Congchi, ; SONI, Tapisha, ; LÖHR, Joachim, ; WU, Lianhai",20241107,20241107,20250912,,,,,,2025,2024
,Triggering a mitigation action based on an artificial intelligence model-based delivery defect prediction,"
                        ","AMAZON TECH INC [US]; Amazon Technologies, Inc","BHATIA TARUN [US];  SRINIVASAN KARTHIK RAM [US];  LIPTAK VALERIE GALLUZZI [US];  ROY CHOWDHURY AMBER [US]; Bhatia, Tarun, ; Srinivasan, Karthik Ram, ; Liptak, Valerie Galluzzi, ; Roy Chowdhury, Amber",20220315,20220315,20250909,,,,,,2025,2022
,Management of connector services and connected artificial intelligence agents for message senders and recipients,"
                        ",AIRIA LLC [US]; Airia LLC,"DEWEESE WILLIAM [US];  MARSHALL JOHN [US];  MORGAN ANDREW [IE];  REAGAN SPENCER [US];  STUNTEBECK ERICH [US]; DeWeese, William, ; Marshall, John, ; Morgan, Andrew, ; Reagan, Spencer, ; Stuntebeck, Erich",20240522,20250228,20250909,,,,,,2025,2025
,Systems and methods for tire press temperature control with artificial intelligence,"
                        ","GORE TEDDY LEE [US];  PARIS IND SERVICES INC [US]; Gore Teddy Lee, ; Paris Industrial Services, Inc","GORE TEDDY LEE [US]; Gore, Teddy Lee",20220919,20220919,20250909,,,,,,2025,2022
,NETWORK DATA ANALYTICS FUNCTION ENHANCEMENTS FOR ARTIFICIAL INTELLIGENCE/MACHINE LEARNING-BASED LOCATION SERVICES POSITIONING,"
                        ","KEDALAGUDDE MEGHASHREE DATTATRI [US];  PALAT SUDEEP [GB];  GUO YI [CN];  LI ZIYI [CN];  CHATTERJEE DEBDEEP [US];  SOJANOVSKI ALEXANDRE SASO [FR];  LUETZENKIRCHEN THOMAS [DE];  ABDOLI JAVAD [US]; KEDALAGUDDE Meghashree Dattatri, ; PALAT Sudeep, ; GUO Yi, ; LI Ziyi, ; CHATTERJEE Debdeep, ; SOJANOVSKI Alexandre Saso, ; LUETZENKIRCHEN Thomas, ; ABDOLI Javad","KEDALAGUDDE MEGHASHREE DATTATRI [US];  PALAT SUDEEP [GB];  GUO YI [CN];  LI ZIYI [CN];  CHATTERJEE DEBDEEP [US];  SOJANOVSKI ALEXANDRE SASO [FR];  LUETZENKIRCHEN THOMAS [DE];  ABDOLI JAVAD [US]; KEDALAGUDDE, Meghashree Dattatri, ; PALAT, Sudeep, ; GUO, Yi, ; LI, Ziyi, ; CHATTERJEE, Debdeep, ; SOJANOVSKI, Alexandre Saso, ; LUETZENKIRCHEN, Thomas, ; ABDOLI, Javad",20240329,20250327,20250911,,,,,,2025,2025
,ARTIFICIAL INTELLIGENCE-BASED SYSTEM FOR AUTHENTICATING A RESOURCE EXCHANGE EVENT BASED ON GEOLOCATION OF A CARDED OR WEARABLE DEVICE,"
                        ",BANK OF AMERICA [US]; BANK OF AMERICA CORPORATION,"HUGGINS ROBERT NYELAND [US];  DINTENFASS KATHERINE KEI-ZEN [US];  MACQUEEN KAREN LEA [US]; Huggins, Robert Nyeland, ; Dintenfass, Katherine Kei-Zen, ; MacQueen, Karen Lea",20220810,20250521,20250911,,,,,,2025,2025
,DATASET IDENTIFICATION FOR ARTIFICIAL INTELLIGENCE AND/OR MACHINE LEARNING AIR INTERFACE USE CASES,"
                        ",QUALCOMM INC [US]; QUALCOMM Incorporated,"HIRZALLAH MOHAMMED ALI MOHAMMED [US];  YOO TAESANG [US];  SUNDARARAJAN JAY KUMAR [US]; HIRZALLAH, Mohammed Ali Mohammed, ; YOO, Taesang, ; SUNDARARAJAN, Jay Kumar",20240307,20240307,20250911,,,,,,2025,2024
,"METHOD, APPARATUS AND SYSTEM FOR PROVIDING SAFETY CARE SERVICE USING ARTIFICIAL INTELLIGENCE","
                        ","NECTARSOFT CO LTD [KR]; Nectarsoft Co., Ltd","PARK SEONG HO [KR];  KANG MYUNG JU [KR];  KIM EUI GU [KR];  KIM DONG-HO [KR]; PARK, Seong Ho, ; KANG, Myung Ju, ; KIM, Eui Gu, ; KIM, Dong-Ho",20240306,20250305,20250911,,,,,,2025,2025
,SPANNING CONTENT TREE FOR INTELLECTUAL CAPITAL CREATION AND CONFIGURATION COMPLETION FUNCTION THROUGH GENERATIVE ARTIFICIAL INTELLIGENCE PROMPT PIPELINE,"
                        ","CISCO TECH INC [US]; Cisco Technology, Inc","PRESTON COREY JAMES [US];  CLEMENS JORDAN MICHAEL [US];  NAINAR NAGENDRA KUMAR [US]; Preston, Corey James, ; Clemens, Jordan Michael, ; Nainar, Nagendra Kumar",20240116,20250521,20250911,,,,,,2025,2025
,SECURITY TOOL USING DATABASE HOOKS WITH ARTIFICIAL INTELLIGENCE,"
                        ","FRANKLIN II STEPHEN ROY [US]; Franklin, II Stephen Roy","FRANKLIN II STEPHEN ROY [US]; Franklin, II, Stephen Roy",20240308,20250303,20250911,,,,,,2025,2025
,MULTISTAGE ALIGNMENT FOR GENERATING ARTIFICIAL INTELLIGENCE TRAINING DATA,"
                        ","DEEPGRAM INC [US]; Deepgram, Inc","WARD JEFFREY MICHAEL [US];  SEAGRAVES ANDREW NATHAN [US];  LIGHTMAN MATTHEW BENSON [US];  STEPHENSON SCOTT IVAN [US];  SYPNIEWSKI ADAM JOSEPH [US]; Ward, Jeffrey Michael, ; Seagraves, Andrew Nathan, ; Lightman, Matthew Benson, ; Stephenson, Scott Ivan, ; Sypniewski, Adam Joseph",20240306,20240306,20250911,,,,,,2025,2024
,"OUTPUT-BASED ATTRIBUTION FOR CONTENT, INCLUDING MUSICAL CONTENT, GENERATED BY AN ARTIFICIAL INTELLIGENCE (AI)","
                        ",SUREEL INC [US]; Sureel Inc,"KUHN CHRISTOPHER BENJAMIN [DE];  AYKUT TAMAY [US]; KUHN, Christopher Benjamin, ; AYKUT, Tamay",20230906,20250526,20250911,,,,,,2025,2025
,ARTIFICIAL INTELLIGENCE-BASED SYSTEM AND METHOD FOR DETERMINING MEDICAL THERAPIES FOR PATIENTS,"
                        ",AINNOCENCE LLC [US]; Ainnocence LLC,"PAN LURONG [US]; Pan, Lurong",20220808,20250521,20250911,,,,,,2025,2025
,ARTIFICIAL INTELLIGENCE MODELING TECHNIQUES FOR VISION-BASED HIGH-FIDELITY OCCUPANCY DETERMINATION AND ASSISTED PARKING APPLICATIONS,"
                        ","TESLA INC [US]; Tesla, Inc","LEE PHILIP [US];  FULTON LAWSON [US];  LEUNG BRANDON [US];  ZHANG XIUMING [US];  DUAN PENGFEI PHIL [US];  GESELOWITZ LEWEY [US]; LEE, Philip, ; FULTON, Lawson, ; LEUNG, Brandon, ; ZHANG, Xiuming, ; DUAN, Pengfei Phil, ; GESELOWITZ, Lewey",20240311,20250310,20250911,,,,,,2025,2025
,ARTIFICIAL INTELLIGENCE ANIMATION PIPELINE,"
                        ",QUALCOMM INC [US]; QUALCOMM Incorporated,"ZHANG NAN [CN];  LI ZHIGUO [CN];  XU YONGJUN [CN]; ZHANG, Nan, ; LI, Zhiguo, ; XU, Yongjun",20230202,20230203,20250911,,,,,,2025,2023
,ARTIFICIAL INTELLIGENCE CHATBOTS USING EXTERNAL KNOWLEDGE ASSETS,"
                        ",MICROSTRATEGY INC [US]; MicroStrategy Incorporated,"HURWOOD WILL [US];  KARUPPIAH DEEPAK [US];  WANG ELLEN [US];  PEREZ JAIME ALBERTO [US];  JIANG QIANPING [US];  ZHAO SHENG [US];  OJHA ANANYA [US];  COURCELLE JEFFREY CLAY [US]; Hurwood, Will, ; Karuppiah, Deepak, ; Wang, Ellen, ; Perez, Jaime Alberto, ; Jiang, Qianping, ; Zhao, Sheng, ; Ojha, Ananya, ; Courcelle, Jeffrey Clay",20240306,20250429,20250911,,,,,,2025,2025
,GENERATIVE ARTIFICIAL INTELLIGENCE FOR CONTENT GENERATION WITH SEARCHABLE REPOSITORY,"
                        ","REVE AI INC [US]; Reve AI, Inc","CANTRELL CHRISTIAN [US];  BREED SAM [US];  NIKOLOV NICK [GB];  PENNA JOE [US];  PEYSAKHOVICH ALEX [US];  PULLARA SAM [US];  STORM MICHAEL [US];  WROBLEWSKI LUKE [US];  WATTENBERGER AMELIA [US]; CANTRELL, Christian, ; BREED, Sam, ; NIKOLOV, Nick, ; PENNA, Joe, ; PEYSAKHOVICH, Alex, ; PULLARA, Sam, ; STORM, Michael, ; WROBLEWSKI, Luke, ; WATTENBERGER, Amelia",20240307,20250306,20250911,,,,,,2025,2025
,Artificial Intelligence Deliberative Assembly (AIDA),"
                        ","AQFER INC [US]; Aqfer, Inc","WILLIAMS ROSS [US];  JAYE DANIEL [US]; Williams, Ross, ; Jaye, Daniel",20240311,20250311,20250911,,,,,,2025,2025
,PERSISTENT LEARNING FOR ARTIFICIAL INTELLIGENCE CHATBOTS,"
                        ",MICROSTRATEGY INC [US]; MicroStrategy Incorporated,"ZHANG JINGBIN [CN];  PEREZ JAIME ALBERTO [US];  JIN TINGTING [US];  WANG ELLEN [US];  KARUPPIAH DEEPAK [US]; Zhang, Jingbin, ; Perez, Jaime Alberto, ; Jin, Tingting, ; Wang, Ellen, ; Karuppiah, Deepak",20240306,20250428,20250911,,,,,,2025,2025
,"MEDIATED ARTIFICIAL SUPER INTELLIGENCE SYSTEM THAT USES INTERNAL SUBJECTIVE EMOTIONS TO DRIVE SELECTION, GOAL SETTING, AND OTHER DECISION-MAKING AS A COLLECTIVE HUMAN AND ARTIFICIAL INTELLIGENCE BASED MIND WITH INTERNAL SUBJECTIVE EXPERIENCE","
                        ",KELLEY DAVID JAMES [US]; Kelley David James,"KELLEY DAVID JAMES [US]; Kelley, David James",20240305,20240305,20250911,,,,,,2025,2024
,ARTIFICIAL INTELLIGENCE SYSTEM WITH AUGMENTED DOCUMENT CAPTURE AND PROCESSING SYSTEMS AND METHODS,"
                        ",OPEN TEXT SA ULC [CA]; Open Text SA ULC,"HUTCHINS GARETH EDWARD [GB]; Hutchins, Gareth Edward",20181228,20250519,20250911,,,,,,2025,2025
,MULTISTAGE ALIGNMENT FOR GENERATING ARTIFICIAL INTELLIGENCE TRAINING DATA,"
                        ","DEEPGRAM INC [US]; Deepgram, Inc","WARD JEFFREY MICHAEL [US];  SEAGRAVES ANDREW NATHAN [US];  LIGHTMAN MATTHEW BENSON [US];  STEPHENSON SCOTT IVAN [US];  SYPNIEWSKI ADAM JOSEPH [US]; Ward, Jeffrey Michael, ; Seagraves, Andrew Nathan, ; Lightman, Matthew Benson, ; Stephenson, Scott Ivan, ; Sypniewski, Adam Joseph",20240306,20240307,20250911,,,,,,2025,2024
,Cardiovascular Disease Classification and Management Using Artificial Intelligence,"
                        ",UNIV NEBRASKA [US]; Board of Regents of the University of Nebraska,"WINDLE JOHN R [US];  SHAMAVU KETEMWABI YVES [US];  WINDLE THOMAS A [US]; Windle, John R, ; Shamavu, Ketemwabi Yves, ; Windle, Thomas A",20230310,20240309,20250911,,,,,,2025,2024
,System And Method For Using Artificial Intelligence (AI) To Analyze Social Media Content,"
                        ",SOCIAL VOICE LTD [IE]; Social Voice Ltd,"O'NEILL ALLEN [IE]; O'Neill, Allen",20230131,20250527,20250911,,,,,,2025,2025
,METHOD AND SYSTEM FOR PREVENTING IDENTITY SPOOFING USING ARTIFICIAL INTELLIGENCE DRIVEN PATTERN RECOGNITION,"
                        ","SIVAKUMAR NITHYA REKHA [SA];  MURUGAN THANGAVEL [AE];  SARKER ABDUR RAHMAN [BD];  PAMBA RAJA VARMA [AE];  ISLAM MOHAMMED MAFIZUL [BD];  AMIN ZIKRA [BD];  SASEENDRAN SARIKA [IN];  MONERUZZAMAN MD [BD];  AZAM S M G [BD];  TAREQ SYED MOHAMMED [US];  SAMAD MD KAMRUS [BD];  TIWARI MOHIT [IN];  REZA MD OMAR FARUQUE [BD];  ALAM SYED MD SHAMSUL [US];  JEYAKUMAR BALAJEE [IN]; SIVAKUMAR Nithya Rekha, ; MURUGAN Thangavel, ; SARKER Abdur Rahman, ; PAMBA Raja Varma, ; ISLAM Mohammed Mafizul, ; AMIN Zikra, ; SASEENDRAN Sarika, ; MONERUZZAMAN Md, ; AZAM S.M.G, ; TAREQ Syed Mohammed, ; SAMAD Md Kamrus, ; TIWARI Mohit, ; REZA Md. Omar Faruque, ; ALAM Syed Md Shamsul, ; JEYAKUMAR Balajee","SIVAKUMAR NITHYA REKHA [SA];  MURUGAN THANGAVEL [AE];  SARKER ABDUR RAHMAN [BD];  PAMBA RAJA VARMA [AE];  ISLAM MOHAMMED MAFIZUL [BD];  AMIN ZIKRA [BD];  SASEENDRAN SARIKA [IN];  MONERUZZAMAN MD [BD];  AZAM S M G [BD];  TAREQ SYED MOHAMMED [US];  SAMAD MD KAMRUS [BD];  TIWARI MOHIT [IN];  REZA MD OMAR FARUQUE [BD];  ALAM SYED MD SHAMSUL [US];  JEYAKUMAR BALAJEE [IN]; SIVAKUMAR, Nithya Rekha, ; MURUGAN, Thangavel, ; SARKER, Abdur Rahman, ; PAMBA, Raja Varma, ; ISLAM, Mohammed Mafizul, ; AMIN, Zikra, ; SASEENDRAN, Sarika, ; MONERUZZAMAN, Md, ; AZAM, S.M.G, ; TAREQ, Syed Mohammed, ; SAMAD, Md Kamrus, ; TIWARI, Mohit, ; REZA, Md. Omar Faruque, ; ALAM, Syed Md Shamsul, ; JEYAKUMAR, Balajee",20250519,20250519,20250911,,,,,,2025,2025
,PLUG AND PLAY EXPLAINABLE ARTIFICIAL INTELLIGENCE SYSTEM AND DESIGN METHOD THEREOF,"
                        ",KONAN TECH INC [KR]; Konan Technology Inc,"LEE JUHYUN [KR];  KIM KYEONGSOO [KR];  JEONG JAEHYEOK [KR];  LEE HYEONGDO [KR];  KANG HYUNSU [KR]; LEE, Juhyun, ; KIM, Kyeongsoo, ; JEONG, Jaehyeok, ; LEE, Hyeongdo, ; KANG, Hyunsu",20240308,20240408,20250911,,,,,,2025,2024
,INTELLIGENT INDUSTRIAL WORKSHOP INSPECTION BASED ON ARTIFICIAL INTELLIGENCE,"
                        ",IBM [US]; International Business Machines Corporation,"DING YUAN YUAN [CN];  YUAN ZHONG FANG [CN];  GAO LI JUAN [CN];  LIU TONG [CN]; Ding, Yuan Yuan, ; Yuan, Zhong Fang, ; Gao, Li Juan, ; Liu, Tong",20240307,20240307,20250911,,,,,,2025,2024
,Artificial Intelligence Systems and Methods for Automatic Property Damage Estimate Generation and Contents Pricing from Textual and Image Data,"
                        ","XACTWARE SOLUTIONS INC [US]; Xactware Solutions, Inc","LEWIS JEFFERY D [US];  YOUNG JEFF [US];  BRUNKO AARON C [US];  MARIN JONATHAN [US]; Lewis, Jeffery D, ; Young, Jeff, ; Brunko, Aaron C, ; Marin, Jonathan",20240307,20250307,20250911,,,,,,2025,2025
,TRANSFORMING FLOATING-POINT ADDITION INTO INTEGER ADDITION FOR ARTIFICIAL INTELLIGENCE APPLICATIONS,"
                        ",INTEL CORP [US]; Intel Corporation,"ZHANG CHUANJUN [US];  BORGES LEONARDO [US];  DIAMOND MITCHELL [US];  FRANZA OLIVIER [US]; Zhang, Chuanjun, ; Borges, Leonardo, ; Diamond, Mitchell, ; Franza, Olivier",20240311,20250210,20250911,,,,,,2025,2025
,Artificial Intelligence Text Scheduling Method,"
                        ",FINANCIAL AI CORP [US]; Financial AI Corp,"HOFFMAN CHRISTOPHER [US]; Hoffman, Christopher",20240308,20250212,20250911,,,,,,2025,2025
,ARTIFICIAL INTELLIGENCE (AI) AGENT FOR GENERATING AND EXECUTING PLANS FOR TASKS,"
                        ",MAPLEBEAR INC [US]; Maplebear Inc,"TAN LI [US];  CHENG YIQUN [US];  SONG JIANKUN [US];  LEONARDO BRANDON [US];  LIN PETER [US]; Tan, Li, ; Cheng, Yiqun, ; Song, Jiankun, ; Leonardo, Brandon, ; Lin, Peter",20240311,20240311,20250911,,,,,,2025,2024
,AGENTIC WORKFLOW SYSTEM AND METHOD FOR POST INFERENCE ADJUSTMENT OF ARTIFICIAL INTELLIGENCE MODEL RESPONSES,"
                        ",SEEKR TECH INC [US]; SEEKR Technologies Inc,"POULIS STEFANOS [US];  BAUER ANDREW J [US];  MESA DIEGO A [US];  CLARK ROBIN J [US];  CONDO PATRICK C [US]; Poulis, Stefanos, ; Bauer, Andrew J, ; Mesa, Diego A, ; Clark, Robin J, ; Condo, Patrick C",20240308,20250325,20250911,,,,,,2025,2025
,"ARTIFICIAL INTELLIGENCE-BASED AGENT AND FRAMEWORK FOR CONTEXTUALIZED, PRIVATE AND DOMAIN-SPECIFIC OUTPUT DRIVEN BY USER-SPECIFIED CONTENT","
                        ","AGBLOX INC [US]; AGBLOX, INC","BLAIR THOMAS N [US];  FEEHAN SEAN [CA];  BURLET GREGORY [CA];  YODER JOSHUA PETER FRANCIS [US];  HUGHES KIRILL RAKHMINOV [US];  LAZARIS SPYROS J [US]; BLAIR, THOMAS N, ; FEEHAN, SEAN, ; BURLET, GREGORY, ; YODER, JOSHUA PETER FRANCIS, ; HUGHES, KIRILL RAKHMINOV, ; LAZARIS, SPYROS J",20230818,20240818,20250911,,,,,,2025,2024
,PREDICTION OF FUTURE OCCURRENCES OF EVENTS USING ADAPTIVELY TRAINED ARTIFICIAL-INTELLIGENCE PROCESSES AND CONTEXTUAL DATA,"
                        ",TORONTO DOMINION BANK [CA]; THE TORONTO-DOMINION BANK,"DICKIE PAIGE ELYSE [CA];  DONG JIANJIN [CA];  POUTANEN TOMI JOHAN [CA];  VOLKOVS MAKSIMS [CA]; DICKIE, Paige Elyse, ; DONG, Jianjin, ; POUTANEN, Tomi Johan, ; VOLKOVS, Maksims",20201231,20250523,20250911,,,,,,2025,2025
,QUESTION ANSWER (QA) PAIR GENERATION USING AGENTIC WORKFLOW SYSTEM AND METHOD THAT ALIGNS ARTIFICIAL INTELLIGENCE MODEL WITH DOMAIN-SPECIFIC PRINCIPLES,"
                        ",SEEKR TECH INC [US]; SEEKR Technologies Inc,"POULIS STEFANOS [US];  BAUER ANDREW J [US];  MESA DIEGO A [US];  CLARK ROBIN J [US];  CONDO PATRICK C [US]; Poulis, Stefanos, ; Bauer, Andrew J, ; Mesa, Diego A, ; Clark, Robin J, ; Condo, Patrick C",20240308,20250324,20250911,,,,,,2025,2025
,AGENTIC WORKFLOW SYSTEM AND METHOD FOR GENERATING SYNTHETIC DATA FOR TRAINING OR POST TRAINING ARTIFICIAL INTELLIGENCE MODELS TO BE ALIGNED WITH DOMAIN-SPECIFIC PRINCIPLES,"
                        ",SEEKR TECH INC [US]; SEEKR Technologies Inc,"POULIS STEFANOS [US];  BAUER ANDREW J [US];  MESA DIEGO A [US];  CLARK ROBIN J [US];  CONDO PATRICK C [US]; Poulis, Stefanos, ; Bauer, Andrew J, ; Mesa, Diego A, ; Clark, Robin J, ; Condo, Patrick C",20240308,20250321,20250911,,,,,,2025,2025
,Pre-Generative Artificial Intelligence Prompt Comparison,"
                        ","SALESFORCE INC [US]; Salesforce, Inc","SHIRRELL MICHAEL [US];  COLE BRIAN [US]; SHIRRELL, Michael, ; Cole, Brian",20240308,20240308,20250911,,,,,,2025,2024
,CREATING AND DISTRIBUTING CUSTOMIZED ARTIFICIAL INTELLIGENCE CHATBOTS,"
                        ",MICROSTRATEGY INC [US]; MicroStrategy Incorporated,"ABHYANKAR SAURABH [US];  COURCELLE JEFFREY CLAY [US]; Abhyankar, Saurabh, ; Courcelle, Jeffrey Clay",20240306,20240306,20250911,,,,,,2025,2024
,ELECTRONIC DEVICE PROVIDING ARTIFICIAL INTELLIGENCE SERVICE AND CONTROL METHOD THEREFOR,"
                        ","SAMSUNG ELECTRONICS CO LTD [KR]; SAMSUNG ELECTRONICS CO., LTD","LEE SUNGHO [KR];  KIM JOONWOO [KR];  KIM HYUNJUN [KR];  IYER VENKATRAMAN GANESHAN [KR];  YI HYUNJIN [KR]; LEE, Sungho, ; KIM, Joonwoo, ; KIM, Hyunjun, ; IYER, Venkatraman Ganeshan, ; YI, Hyunjin",20221201,20250523,20250911,,,,,,2025,2025
,QUANTUM MIRROR MODE FOR ARTIFICIAL INTELLIGENCE (AI) MODELS,"
                        ",BANK OF AMERICA [US]; Bank of America Corporation,"ALBERO GEORGE [US]; Albero, George",20240311,20240311,20250911,,,,,,2025,2024
,SYSTEMS AND METHODS FOR EVALUATING GENERATIVE ARTIFICIAL INTELLIGENCE (AI) SOLUTIONS,"
                        ",STATE FARM MUTUAL AUTOMOBILE INSURANCE CO [US]; State Farm Mutual Automobile Insurance Company,"SCHMITT JAY W [US]; Schmitt, Jay W",20240307,20250205,20250911,,,,,,2025,2025
,ARTIFICIAL INTELLIGENCE CHATBOT FOR DATA PLATFORM SECURITY ANALYSIS,"
                        ","COHESITY INC [US]; Cohesity, Inc","MANJHI DEVESH [IN];  HARSOOR SHARAN [IN];  SHEKHAR SHOBHIT [IN];  GUPTA PRAMESH [IN]; Manjhi, Devesh, ; Harsoor, Sharan, ; Shekhar, Shobhit, ; Gupta, Pramesh",20240307,20241122,20250911,,,,,,2025,2024
,SYSTEMS AND METHODS FOR THREAT MITIGATION USING ARTIFICIAL INTELLIGENCE,"
                        ","WELLS FARGO BANK NA [US]; Wells Fargo Bank, N.A","KETHARAJU RAMESHCHANDRA BHASKAR [IN]; Ketharaju, Rameshchandra Bhaskar",20230123,20250527,20250911,,,,,,2025,2025
,ARTIFICIAL INTELLIGENCE GOVERNED PROCESSOR,"
                        ",IBM [US]; International Business Machines Corporation,"TRILLA RODRÍGUEZ DAVID [US];  BUYUKTOSUNOGLU ALPER [US]; Trilla Rodríguez, David, ; Buyuktosunoglu, Alper",20240306,20240306,20250911,,,,,,2025,2024
,USING GENERATIVE ARTIFICIAL INTELLIGENCE TO IMPROVE USER INTERACTIONS,"
                        ",TORONTO DOMINION BANK [CA]; The Toronto-Dominion Bank,"MOHAMMED SHAHZAD [CA];  D'AGOSTINO DINO PAUL [CA]; MOHAMMED, Shahzad, ; D'AGOSTINO, Dino Paul",20231031,20250526,20250911,,,,,,2025,2025
,ARTIFICIAL INTELLIGENCE MODELING TECHNIQUES FOR VISION-BASED HIGH-FIDELITY OCCUPANCY DETERMINATION AND ASSISTED PARKING APPLICATIONS,"
                        ","TESLA INC [US]; Tesla, Inc","LEE PHILIP [US];  FULTON LAWSON [US];  MO ZICONG [US];  LEUNG BRANDON [US];  ZHANG XIUMING [US];  DUAN PENGFEI PHIL [US];  ELLUSWAMY ASHOK KUMAR [US];  PHAM TOAN [US];  SARCOVSCHI IGOR [US];  SMALL EVAN [US]; LEE, Philip, ; FULTON, Lawson, ; MO, Zicong, ; LEUNG, Brandon, ; ZHANG, Xiuming, ; DUAN, Pengfei Phil, ; ELLUSWAMY, Ashok Kumar, ; PHAM, Toan, ; SARCOVSCHI, Igor, ; SMALL, Evan",20240311,20250310,20250911,,,,,,2025,2025
,GROUP AND AREA ARTIFICIAL INTELLIGENCE GENERATED CONTENT,"
                        ",IGT RENO NEV [US]; IGT,"NELSON DWAYNE [US];  ALVAREZ JACKIE [US];  RUSS MICHAEL [AT];  WAGNER ROMANA [AT]; Nelson, Dwayne, ; Alvarez, Jackie, ; Russ, Michael, ; Wagner, Romana",20240306,20240306,20250911,,,,,,2025,2024
,BODY FLUID MOVEMENT SYSTEM WITH ONE OR MORE SENSORS AND ARTIFICIAL INTELLIGENCE,"
                        ","BRUBAKER WILLIAM [US];  DAVIS PAUL [US]; Brubaker William, ; Davis Paul","BRUBAKER WILLIAM [US];  DAVIS PAUL [US]; Brubaker, William, ; Davis, Paul",20240105,20250224,20250911,,,,,,2025,2025
,Breast Cancer Screening of Xray-Dense Breasts Using Rotary ABUS and Advanced Artificial Intelligence,"
                        ",WANG SHIH PING [US]; Wang Shih-Ping,"WANG SHIH-PING [US]; Wang, Shih-Ping",20050901,20250526,20250911,,,,,,2025,2025
,"ARTIFICIAL INTELLIGENCE BASED NEONATAL SEIZURE DETECTION DEVICE, SYSTEM AND METHOD","
                        ",REKOVAR INC [US]; Rekovar Inc,"SHARAREH SHIVA [US]; Sharareh, Shiva",20240308,20250310,20250911,,,,,,2025,2025
,ARTIFICIAL INTELLIGENCE BASED INTEGRATION FRAMEWORKS,"
                        ",PAYMENTUS CORP; PAYMENTUS CORPORATION,"SHARMA DUSHYANT; SHARMA, Dushyant",20211026,20250822,20250911,,,,,,2025,2025
,WIRELESS DEVICE POWER OPTIMIZATION UTILIZING ARTIFICIAL INTELLIGENCE AND/OR MACHINE LEARNING,"
                        ",SCHLAGE LOCK CO LLC; Schlage Lock Company LLC,"KINCAID RYAN C;  VENKATESWARAN SRIKANTH;  PROSTKO ROBERT; KINCAID, Ryan C, ; VENKATESWARAN, Srikanth, ; PROSTKO, Robert",20191113,20250822,20250911,,,,,,2025,2025
,DEVICE FOR PROCESSING DIVERSE DATA IN DECISION SUPPORT SYSTEMS WITH ARTIFICIAL INTELLIGENCE ELEMENTS,"
                        ",KHARKIV NATIONAL AUTOMOBILE AND HIGHWAY UNIV [UA]; ХАРКІВСЬКИЙ НАЦІОНАЛЬНИЙ АВТОМОБІЛЬНО-ДОРОЖНІЙ УНІВЕРСИТЕТ,"KASHKEVYCH SVITLANA OLEKSANDRIVNA [UA];  SHYSHATSKYI ANDRII VOLODYMYROVYCH [UA];  NERONOV SERHII MYKOLAIOVYCH [UA];  PLIEKHOVA HANNA ANATOLIIVNA [UA];  YEFYMENKO OLEKSANDR VOLODYMYROVYCH [UA];  PLIEKHOV DANYLO OLEKSANDROVYCH [UA];  BAHMUT ROMAN BORYSOVYCH [UA];  HURKO OLEKSANDR HENNADIIOVYCH [UA];  VOZNYTSIA ANASTASYIA SERHIIVNA [UA];  YATSENKO OLEKSII OLEKSIIOVYCH [UA];  KOCHYNA ANASTASIIA ANATOLIIVNA [UA];  LIUBYI YEVHEN VOLODYMYROVYCH [UA];  ASAIENKO YURII SERHIIOVYCH [UA];  SHARONOVA NATALIIA VALERIIVNA [UA]; Кашкевич Світлана Олександрівна, ; Шишацький Андрій Володимирович, ; Неронов Сергій Миколайович, ; Плєхова Ганна Анатоліївна, ; Єфименко Олександр Володимирович, ; Плєхов Данило Олександрович, ; Багмут Роман Борисович, ; Гурко Олександр Геннадійович, ; Возниця Анастасия Сергіївна, ; Яценко Олексій Олексійович, ; Кочина Анастасія Анатоліївна, ; Любий Євген Володимирович, ; Асаєнко Юрій Сергійович, ; Шаронова Наталія Валеріївна",20250331,20250331,20250910,,,,,,2025,2025
,"Procédé de dépistage de bout-en-bout du cancer du col de l'utérus via un système intégré et connecté combinant la cytologie supportée par l'intelligence artificielle, et un test PCR approuvé de papillomavirus humains oncogènes","
                        ",DATA PATHOLOGY [MA]; DATA PATHOLOGY,EL ATTAR HICHAM [MA]; EL ATTAR HICHAM,20231208,20231208,20250731,,,,,,2025,2023
,SYSTEM AND PROCEDURE FOR REASONING DECISIONS IN ARTIFICIAL INTELLIGENCE-BASED SYSTEMS,"
                        ",HYMANIZED DOO BEOGRAD [RS]; HYMANIZED DOO BEOGRAD,"PAVKOVIĆ BOGDAN [RS];  STEPANOVIĆ MIA [RS];  STANKOVIĆ MILOŠ [RS];  KOVAČEV NEMANJA [RS]; PAVKOVIĆ, BOGDAN, ; STEPANOVIĆ, MIA, ; STANKOVIĆ, MILOŠ, ; KOVAČEV, NEMANJA",20240214,20240214,20250829,,,,,,2025,2024
,DATA INTERACTION NETWORK SECURITY SYSTEM BASED ON ARTIFICIAL INTELLIGENCE,"
                        ",UNIV XINYU [CN]; Xinyu University,"LI SHIWEN [CN];  LIU JINHUA [CN];  LIU MINGQI [CN];  LIU XUEPING [CN];  LUO HAIYONG [CN];  LIU ZEQI [CN]; Li Shiwen, ; Liu Jinhua, ; Liu Mingqi, ; Liu Xueping, ; Luo Haiyong, ; Liu Zeqi",20250124,20250124,20250827,,,,,,2025,2025
,COMMANDE D'ORIENTATION ADAPTATIVE POUR SYSTÈMES D'INTELLIGENCE ARTIFICIELLE INTERACTIFS,"
                        ","DOPPLE WORKS INC [US]; DOPPLE WORKS, INC","FODOR GREGORY [US];  KALIN ROBERT [US];  CHATTERTON GEOFFREY [US]; FODOR, Gregory, ; KALIN, Robert, ; CHATTERTON, Geoffrey",20240228,20250228,20250904,,,,,,2025,2025
,"DISPOSITIF D'INTELLIGENCE ARTIFICIELLE, PROCÉDÉ D'AUGMENTATION DE DONNÉES DE DISPOSITIF D'INTELLIGENCE ARTIFICIELLE ET SUPPORT D'ENREGISTREMENT NON VOLATIL","
                        ","LG ELECTRONICS INC [KR];  LG MAN DEVELOPMENT INSTITUTE [KR]; 엘지전자 주식회사, ; 주식회사 LG 경영개발원","GU GEONMO [KR];  SHIM HYUNSEUNG [KR];  MOON HAKSOO [KR];  KWAK JAEHO [KR];  JEON HYEJEONG [KR]; 구건모, ; 심현승, ; 문학수, ; 곽재호, ; 전혜정",20240226,20250220,20250904,,,,,,2025,2025
,PROCÉDÉ ET APPAREIL POUR FOURNIR UN SERVICE DE CONFÉRENCE BASÉ SUR L'INTELLIGENCE ARTIFICIELLE,"
                        ",CHUN JONG YOON [KR]; 천종윤,CHUN JONG YOON [KR]; 천종윤,20240228,20250228,20250904,,,,,,2025,2025
,PROCÉDÉ ET APPAREIL DE MISE À JOUR D'UN MODÈLE D'INTELLIGENCE ARTIFICIELLE DANS UN SYSTÈME DE COMMUNICATION SANS FIL,"
                        ",SAMSUNG ELECTRONICS CO LTD [KR]; 삼성전자 주식회사,"RHYU SUNGRYEUL [KR];  YIP ERIC [KR]; 유성열, ; 입에릭",20240226,20250226,20250904,,,,,,2025,2025
,"SYSTÈME, PROCÉDÉ ET PRODUIT PROGRAMME D'ORDINATEUR POUR UNE CORRECTION D'ÉTAT DE MODÈLES D'INTELLIGENCE ARTIFICIELLE","
                        ",VISA INT SERVICE ASS [US]; VISA INTERNATIONAL SERVICE ASSOCIATION,"WANG SHENG [US];  XIAO WEIZHOU [US];  WANG DAN [US];  KAN XI [US];  WANG XUTONG [US];  WANG SHUO [US]; WANG, Sheng, ; XIAO, Weizhou, ; WANG, Dan, ; KAN, Xi, ; WANG, Xutong, ; WANG, Shuo",20240227,20240227,20250904,,,,,,2025,2024
