patent_id,title,abstract,assignee,inventor_author,priority_date,filing_date,publication_date,grant_date,result_link,image_link,language,technology_category,publication_year,filing_year
,Postoperative rehabilitation nursing system for old people based on artificial intelligence,"
                        ",THE SECOND MEDICAL CENTER OF CHINESE PLA GENERAL HOSPITAL; 中国人民解放军总医院第二医学中心,"LUO MIN;  HU PEI;  BU JIE;  CHE QI;  DUAN YUANYUAN;  JIANG YANG;  LIU LUCHUAN;  KURUMATSU;  YUAN YUXIN;  MO CHEN; 罗敏, ; 胡佩, ; 布洁, ; 车琦, ; 段媛媛, ; 姜旸, ; 刘鲁川, ; 来松, ; 元钰鑫, ; 莫晨",20250414,20250414,20250725,,,,,,2025,2025
,Wafer surface defect detection method and system based on artificial intelligence,"
                        ",ZHEJIANG LISHUI ZHONGXIN JINGYUAN SEMICONDUCTOR TECH CO LTD; 浙江丽水中欣晶圆半导体科技有限公司,"WANG JUNMING;  ZHANG YUFENG;  GUO CHUNLIN; 王军明, ; 张玉凤, ; 郭春林",20250627,20250627,20250725,,,,,,2025,2025
,Traditional Chinese medicine artificial intelligence auxiliary diagnosis and treatment system and construction method,"
                        ",QINGDAO HUAXIN WISDOM TECH CO LTD; 青岛华信智慧科技有限公司,"LI QIANG;  CHEN CHENG;  CHEN ZHENG;  ZHOU FANGYU; 李强, ; 陈铖, ; 陈峥, ; 周芳羽",20250627,20250627,20250725,,,,,,2025,2025
,Intelligent manufacturing system scheduling method driven by artificial intelligence,"
                        ",ZIRAN YUYI QINGDAO TECH CO LTD; 自然语义（青岛）科技有限公司,"SUN YANQUN;  PANG FEI; 孙燕群, ; 逄菲",20250630,20250630,20250725,,,,,,2025,2025
,Electric power system optimization scheduling method based on artificial intelligence,"
                        ",GANSU SHINING SCIENCE & TECH CO LTD; 甘肃同兴智能科技发展有限责任公司,"YANG LEI;  MA WEIWEI; 杨磊, ; 马卫卫",20250626,20250626,20250725,,,,,,2025,2025
,Artificial intelligence model control system and control method,"
                        ",ZOKINRE XIAMEN ENVIRONMENT TECH CO LTD; 中清睿（厦门）环境科技有限公司,"WANG ZILONG;  CHEN XIANGQI; 王子龙, ; 陈祥奇",20250625,20250625,20250725,,,,,,2025,2025
,Artificial intelligence-based bionic scalp massage glove,"
                        ",XIAN RENBAOE IMAGE DESIGN CO LTD; 西安任宝娥形象设计有限公司,REN BAO'E; 任宝娥,20250523,20250523,20250725,,,,,,2025,2025
,Oral cancer artificial intelligence auxiliary diagnosis method and device based on real oral image,"
                        ",UNIV WUHAN; 武汉大学,"WANG ZIHE;  HU QINGWU;  SHANG ZHENGJUN;  AI MINGYAO;  ZHAO PENGCHENG;  YOO CHEON-SEONG;  WANG ZHIYUE;  JIANG CHUJIAN;  FAN BING;  CAO RUI; 王子赫, ; 胡庆武, ; 尚政军, ; 艾明耀, ; 赵鹏程, ; 柳天成, ; 王之玥, ; 蒋楚剑, ; 范兵, ; 曹睿",20250424,20250424,20250725,,,,,,2025,2025
,Evaluation and calculation method for artificial intelligence understanding and generating ability,"
                        ",CHINA ELECTRONICS STANDARDIZATION INSTITUTE ELECTRONICS STANDARDIZATION INSTITUTE OF MINISTRY OF IND; 中国电子技术标准化研究院（（工业和信息化部电子工业标准化研究院）（工业和信息化部电子第四研究院））,"BAO WEI;  XU YANG;  ZHENG RUOLIN;  YE HENG;  DONG JIAN;  ZHOU HONGLI; 鲍薇, ; 徐洋, ; 郑若琳, ; 叶珩, ; 董建, ; 周宏理",20250418,20250418,20250725,,,,,,2025,2025
,Intra-hospital logistics robot distribution time prediction system based on artificial intelligence,"
                        ",HEFEI WALI JUEQI ROBOT TECH CO LTD; 合肥瓦力觉启机器人科技有限公司,"LI YONG;  SUN ZHICHENG;  SHUI PANPAN; 李勇, ; 孙志诚, ; 水盼盼",20250409,20250409,20250725,,,,,,2025,2025
,Artificial intelligence image analysis-based hypoxia-driven papillary thyroid carcinoma recurrence risk prediction system,"
                        ",JIANGSU PROVINCE HOSPITAL FIRST AFFILIATED HOSPITAL WITH NANJING MEDICAL UNIV; 江苏省人民医院（南京医科大学第一附属医院）,"ZHOU YAN;  XU XIAOQUAN;  SU GUOYI;  ZHANG JIULOU;  HU YU;  LI XIAO;  ZHAO WEN;  XU FENG;  HAN DAN;  WU FEIYUN; 周燕, ; 许晓泉, ; 苏国义, ; 张久楼, ; 胡彧, ; 李霄, ; 赵雯, ; 徐峰, ; 韩丹, ; 吴飞云",20250409,20250409,20250725,,,,,,2025,2025
,Artificial intelligence-based flight control quality evaluation method and system,"
                        ",NANJING VOCATIONAL UNIV OF INDUSTRY TECHNOLOGY; 南京工业职业技术大学,"GUO YUNDONG;  ZHOU ZHONG;  XU TENGZHOU;  SUO XINSHI;  ZHAO YANQI; 郭云东, ; 周忠, ; 徐滕州, ; 索欣诗, ; 赵艳启",20250403,20250403,20250725,,,,,,2025,2025
,Spleen and liver trauma model establishing method based on artificial intelligence,"
                        ",ZHEJIANG HOSPITAL; 浙江医院,ZHU GENFEI; 祝根飞,20250330,20250330,20250725,,,,,,2025,2025
,Method for checking Chinese homophone wrongly written characters and similar characters based on artificial intelligence,"
                        ",HARBIN SIHE INFORMATION TECH CO LTD; 哈尔滨思和信息技术股份有限公司,"LI NAN;  ZHANG BOJIAN;  WANG XU; 李楠, ; 张伯鉴, ; 王旭",20250224,20250224,20250725,,,,,,2025,2025
,Intelligent collaborative management method and platform based on artificial intelligence driving,"
                        ",BANK OF BEIJING CO LTD; 北京银行股份有限公司,"DING ZHIYONG;  PANG BO;  XUE CHANG;  GAO LIJUN;  SHEN YUXIN;  LU WEI;  BEI DONGSHENG;  WAN CHANGSONG;  LI BOHUA; 丁志勇, ; 庞博, ; 薛畅, ; 高丽珺, ; 沈雨欣, ; 卢苇, ; 贝东昇, ; 万长松, ; 李博华",20250625,20250625,20250725,,,,,,2025,2025
,Medical record classification early warning method based on artificial intelligence,"
                        ",LIANYUNGANG MATERNAL AND CHILD HEALTH HOSPITAL LIANYUNGANG THIRD PEOPLES HOSPITAL; 连云港市妇幼保健院（连云港市第三人民医院）,"LUO JIE;  WANG LEILEI;  WANG ZIXIAN;  ZHAO XIURONG; 骆洁, ; 王雷雷, ; 汪子贤, ; 赵秀荣",20250411,20250411,20250725,,,,,,2025,2025
,Artificial intelligence-based Thai speech recognition method and system,"
                        ",NANNING YUNSHU ZHICHUANG TECH CO LTD; 南宁云枢智创科技有限公司,"LIN YANGSHI;  ZHONG MINGHUI;  WU YUE'ER;  SONG ZHIMIN;  ZHU MANLI;  YAN HANFANG;  MO MANXING;  LIAO JIAQI;  HUANG KEXIN; 林洋仕, ; 钟明辉, ; 邬月儿, ; 宋志敏, ; 朱曼丽, ; 颜含芳, ; 莫满星, ; 廖佳琪, ; 黄可昕",20250508,20250508,20250725,,,,,,2025,2025
,Artificial intelligence model question solving ability evaluation method and system for dynamically synthesizing test questions,"
                        ",UNIV BEIJING NORMAL; 北京师范大学,"HUANG HUA;  WANG MEI;  ZHANG TING;  HOU YUJIE; 黄华, ; 王玫, ; 张婷, ; 侯宇杰",20250414,20250414,20250725,,,,,,2025,2025
,Self-adaptive education system based on artificial intelligence,"
                        ",GUANGZHOU XINHUA UNIV; 广州新华学院,"WU DONG;  LI WENJIE; 武冬, ; 李汶洁",20250411,20250411,20250725,,,,,,2025,2025
,Method for providing description of artificial intelligence model based on plug-and-play mode,"
                        ",KOREA ADVANCED INST SCI & TECH; 韩国科学技术院,CHOI JAE-SIK; 崔宰植,20221216,20231213,20250725,,,,,,2025,2023
,Building design scene automatic generation method and system based on artificial intelligence,"
                        ",GANSU BAIYOU XIONGGUAN NEW BUILDING MAT CO LTD; 甘肃百优雄关新型建材有限公司,"JIANG CHAO;  WU HUIYING;  JIN MING;  LIANG JIANLIANG;  YANG ZHONGYI;  ZHANG JUNLING;  LIU JUNQI;  ZHANG PAN;  YU XIAOYU;  GENG LONGFEI;  YANG FENGTIAN;  WU LEI;  LI YONGWEI; 姜超, ; 吴会营, ; 金明, ; 梁健良, ; 杨忠义, ; 张俊领, ; 刘峻琪, ; 张盼, ; 于晓宇, ; 耿龙飞, ; 杨丰天, ; 吴磊, ; 李永伟",20250624,20250624,20250725,,,,,,2025,2025
,Car insurance fraud identification method based on artificial intelligence,"
                        ",ZHESHANG PROPERTY INSURANCE CO LTD; 浙商财产保险股份有限公司,"ZHU JIN;  YOU JUNBIN;  HOU SHOULI; 祝津, ; 尤俊斌, ; 侯守立",20250623,20250623,20250725,,,,,,2025,2025
,Mental disease diagnosis system and method using exosome SERS signal based on artificial intelligence,"
                        ","ISOPORT CORP;  UNIV KOREA RES & BUS FOUND; 艾索波特株式会社, ; 高丽大学产学合作团","SHIN HYUN-KU;  CHOI YEON-HO;  HAM BYUNG JU; 申铉球, ; 崔然皓, ; 咸柄柱",20221031,20221104,20250725,,,,,,2025,2022
,"Metal impurity identification method and device based on artificial intelligence, equipment and medium","
                        ",HANGZHOU TIANYAN ZHILIAN TECH CO LTD; 杭州天眼智联科技有限公司,"ZHOU YUAN;  TAN TIAN;  FANG MINGCHAO; 周媛, ; 谭天, ; 方明超",20250627,20250627,20250725,,,,,,2025,2025
,Separation system for bio-based material manufacturing based on artificial intelligence,"
                        ",JIANGSU BEISEN INTELLIGENT TECH CO LTD; 江苏贝森智能科技有限公司,"ZHANG KE;  SHI YUCHENG;  TANG BING;  ZHANG HUI; 张可, ; 石煜诚, ; 汤兵, ; 张辉",20250609,20250609,20250725,,,,,,2025,2025
,Tracking type photovoltaic support optimization method and system based on artificial intelligence,"
                        ",JIANGSU NABEEI ALUMINUM CO LTD; 江苏纳贝铝业有限公司,SUN HAO; 孙浩,20250427,20250427,20250725,,,,,,2025,2025
,Inter-enterprise contact active construction method and system based on artificial intelligence,"
                        ",HANGZHOU QIANYU QIANXUN TECH CO LTD; 杭州千鱼千寻科技有限公司,"LIU RONGJUN;  CAI HUA;  ZHOU KANQI; 柳荣军, ; 蔡华, ; 周侃奇",20250417,20250417,20250725,,,,,,2025,2025
,Electric power engineering construction risk early warning system based on artificial intelligence,"
                        ",ANHUI JIAHE NEW ENERGY TECH CO LTD; 安徽佳合新能源科技有限公司,"ZHAO HAISHENG;  LI YAGUANG; 赵海生, ; 李亚光",20250416,20250416,20250725,,,,,,2025,2025
,Accounting document classification method and system based on artificial intelligence,"
                        ",JILIN TECH COLLEGE OF ELECTRONIC INFORMATION; 吉林电子信息职业技术学院,ZHANG YILONG; 张艺泷,20250401,20250401,20250725,,,,,,2025,2025
,"Call-out quality inspection method, system and device based on artificial intelligence and medium","
                        ",HCR CO LTD; 北京慧辰资道资讯股份有限公司,"ZHANG XINZHUANG;  ZHOU PENGFEI; 张新壮, ; 周鹏飞",20250311,20250311,20250725,,,,,,2025,2025
,Artificial intelligence pressure feedback device with voice mode recognition function,"
                        ",INDUSTRY ACADEMIC COOPERATION FOUNDATION SUNMOON UNIV; 鲜文大学校产学协力团,"YOON JONG-HWAN;  KANG MIN-SOO; 尹钟焕, ; 姜旼秀",20240123,20240131,20250725,,,,,,2025,2024
,Financial data analysis method based on artificial intelligence,"
                        ",UNIV HARBIN NORMAL; 哈尔滨师范大学,HAN XING; 韩幸,20250416,20250416,20250725,,,,,,2025,2025
,Finance and accounting document data summarization method based on OCR correction by artificial intelligence,"
                        ",NORTH CHINA SEA FORECAST DISASTER REDUCTION CENTER OF MINI OF NATURAL RESOURCES QINGDAO OCEAN CENTER; 自然资源部北海预报减灾中心（自然资源部青岛海洋中心）,"SUN JINGYI;  LIU XIAOFEI;  LU BO;  WU FENGCONG;  HOU XIAOWEI;  YU BO;  QU WEN;  MA HAIJING;  WANG CUI;  DENG BAIHE; 孙静宜, ; 刘晓飞, ; 卢博, ; 吴凤丛, ; 侯晓薇, ; 于博, ; 屈文, ; 马海静, ; 王翠, ; 邓百合",20250616,20250616,20250725,,,,,,2025,2025
,Artificial intelligence-based retinopathy image classification method for diabetic nephropathy patient,"
                        ",UNIV ZHENGZHOU; 郑州大学,"ZHOU SIJIE;  LIU ZHANGSUO;  ZHAO ZIHAO;  HU MINGYANG;  LYU LINXIAO;  ZHANG JIAHUI;  LI JIACHENG; 周思捷, ; 刘章锁, ; 赵子豪, ; 胡明阳, ; 吕林晓, ; 张家惠, ; 李嘉诚",20250415,20250415,20250725,,,,,,2025,2025
,"Accelerator configured to perform artificial intelligence calculation, method of operating accelerator, and artificial intelligence system including accelerator","
                        ","SAMSUNG ELECTRONICS CO LTD;  NAVER CORP; 三星电子株式会社, ; 纳宝株式会社","JANG JAE-HOON;  JEON YOUN-HO;  KIM JAE-JU;  SON HONG-RAK;  SHIN DONG-MIN;  KWON SE JUNG;  KIM BYUNG WOOK;  PARK BAE-SEONG;  YU JI-WEON;  LEE DONG-SOO; 张宰薰, ; 田仑澔, ; 金在燽, ; 孙弘乐, ; 申东旻, ; 权世重, ; 金炳旭, ; 朴培盛, ; 柳志源, ; 李桐洙",20240124,20241209,20250725,,,,,,2025,2024
,Intelligent shuttlecock recovery and integrity detection sorting method and system based on artificial intelligence,"
                        ",XIE WENRUI; 谢文睿,"XIE WENRUI;  SUN YU-CHEN;  TONG YANHUAN;  TANG YUANYUAN;  WEI HANG;  HUANG YUFAN;  YIN WEIQING;  JIANG ZHITAO;  XU JIAWEI; 谢文睿, ; 孙宇辰, ; 童琰焕, ; 唐媛媛, ; 韦航, ; 黄昱凡, ; 殷渭清, ; 江智涛, ; 徐家威",20250425,20250425,20250725,,,,,,2025,2025
,Client management system and method based on artificial intelligence,"
                        ",SHENZHEN QICHENG ZHIYUAN NETWORK TECH CO LTD; 深圳启程智远网络科技有限公司,"LI XUEYONG;  LI QUNDI;  LI WEN;  WANG JIANGANG;  LU JIANGWEI;  OU LUYONG; 李雪勇, ; 李群娣, ; 李文, ; 王建刚, ; 卢江伟, ; 欧陆拥",20250423,20250423,20250725,,,,,,2025,2025
,Data tracing and tracking method for block chain based on artificial intelligence technology,"
                        ",JIANGSU FEHO INFORMATION TECH CO LTD; 江苏飞浩信息科技有限公司,"GAO PENGFEI;  QIAN XINGYU;  XIA ZEJUN;  LIU HAO;  WANG HONG; 高鹏飞, ; 钱兴宇, ; 夏泽军, ; 刘昊, ; 王宏",20250410,20250410,20250725,,,,,,2025,2025
,Martial arts action recognition and action quality evaluation method based on artificial intelligence,"
                        ",HARBIN INST TECHNOLOGY; 哈尔滨工业大学,"WANG LU;  WANG HAI;  GAO HEYU;  LI XUE; 王璐, ; 王海, ; 高赫蔚, ; 李雪",20250423,20250423,20250725,,,,,,2025,2025
,Security-based artificial intelligence workload allocation in heterogeneous environments,"
                        ",DELL PRODUCTS LP; 戴尔产品有限公司,"KELLY JOHN;  CHANDRASEKARAN BALASUBRAMANIAN;  PATEL DHAVAL M; J·凯利, ; B·钱德拉塞卡兰, ; D·M.·帕特尔",20240123,20250107,20250725,,,,,,2025,2025
,AI accompanying system and method based on general artificial intelligence,"
                        ",BEIJING GUANGRONG INNOVATION TECH CO LTD; 北京广荣创新科技有限公司,"CHEN BINBIN;  CUI YANDA; 陈斌斌, ; 崔燕达",20250415,20250415,20250725,,,,,,2025,2025
,"Data recommendation method and device based on artificial intelligence, computer equipment and medium","
                        ",PING AN HEALTH INSURANCE CO LTD; 平安健康保险股份有限公司,NIE WEI; 聂伟,20250414,20250414,20250725,,,,,,2025,2025
,"Intelligent vault security method and system based on artificial intelligence, and computing device","
                        ",HUNAN WANLEI SECURITY AND PROTECTION TECH DEVELOPMENT CO LTD; 湖南万磊安防科技发展有限公司,"ZHANG KUN;  ZHANG AO; 张锟, ; 张敖",20250529,20250529,20250725,,,,,,2025,2025
,Knowledge distillation-based high-speed flow interpretable artificial intelligence control method,"
                        ",UNIV PLA AIR FORCE ENGINEERING; 中国人民解放军空军工程大学,"ZONG HAOHUA;  WU YUN;  SU ZHI;  LI JINPING;  LIANG HUA; 宗豪华, ; 吴云, ; 苏志, ; 李金平, ; 梁华",20250626,20250626,20250725,,,,,,2025,2025
,Environment monitoring method and system based on artificial intelligence,"
                        ",XIANGHE COUNTY BRANCH LANGFANG ECOLOGICAL ENV BUREAU; 廊坊市生态环境局香河县分局,YANG DAN; 杨丹,20250411,20250411,20250725,,,,,,2025,2025
,"Product recommendation method and device based on artificial intelligence, computer equipment and medium","
                        ",PING AN HEALTH INSURANCE CO LTD; 平安健康保险股份有限公司,LU PENG; 陆鹏,20250407,20250407,20250725,,,,,,2025,2025
,"Video conference interaction method and device based on artificial intelligence, server and medium","
                        ",PING AN LIFE INSURANCE CO CHINA LTD; 中国平安人寿保险股份有限公司,"MAN YUANYUAN;  WU SHUYING; 满园园, ; 吴书颖",20250528,20250528,20250725,,,,,,2025,2025
,Artificial intelligence auxiliary intelligent driving system based on driving blind area,"
                        ",ANHUI KALUOTE TECH CO LTD; 安徽卡罗特科技有限公司,"LIU ZEWEN;  GUAN RENYOU;  LIN ZHEN; 刘泽文, ; 管仁友, ; 林振",20250513,20250513,20250725,,,,,,2025,2025
,Clinical research data safety equipment wearing state monitoring method and system based on artificial intelligence,"
                        ",THE SECOND HOSPITAL OF ANHUI MEDICAL UNIV; 安徽医科大学第二附属医院,"HU WEI;  CHEN XIAO;  ZHANG QIAN;  ZHAO YINGJIE;  ZHENG LIANG; 胡伟, ; 陈筱, ; 张茜, ; 赵英杰, ; 郑亮",20250424,20250424,20250725,,,,,,2025,2025
,Digital orthoimage and DSM registration method and system based on artificial intelligence,"
                        ",CHINA NONFERROUS BLUEPRINT TECH CO LTD; 中色蓝图科技股份有限公司,"ZHANG LU;  FU HE;  LI YING;  MA ZHAOHUI;  ZENG FANHANG;  HUANG XUEJING;  ZHENG XINGLI;  ZHAO FANGBO;  CUI CHAOFENG;  KANG KAI; 张璐, ; 付和, ; 李莹, ; 马昭辉, ; 曾范航, ; 黄雪静, ; 郑兴丽, ; 赵方博, ; 崔超峰, ; 康凯",20250624,20250624,20250725,,,,,,2025,2025
,Waviness measurement precision correction method and system based on artificial intelligence,"
                        ",XIAN WELL MEASURING INSTR CO LTD; 西安威尔测量仪器有限公司,"FAN HOUJIE;  WANG HAITAO;  ZHANG TAO;  WANG LEI; 范厚杰, ; 王海涛, ; 张涛, ; 王蕾",20250623,20250623,20250725,,,,,,2025,2025
,"Family-school collaborative foreign language teaching system and method based on education artificial intelligence and integrating interest, curiosity and like","
                        ",ZHANG JINGFEI; 张景飞,ZHANG JINGFEI; 张景飞,20250428,20250428,20250725,,,,,,2025,2025
,Operation data management system and method based on artificial intelligence,"
                        ",JINLING INST TECHNOLOGY; 金陵科技学院,TIAN HAIMEI; 田海梅,20250408,20250408,20250725,,,,,,2025,2025
,Content promotion method and device based on artificial intelligence,"
                        ",GUANGZHOU DULING TECH CO LTD; 广州度岭科技有限公司,"MOU YANTAO;  HUANG BIN;  CHU YANJIE;  GAO JIAXIANG;  LU YAN; 牟彦滔, ; 黄彬, ; 褚妍婕, ; 高佳祥, ; 卢燕",20250402,20250402,20250725,,,,,,2025,2025
,Cordyceps militaris distinguishing method and system based on artificial intelligence,"
                        ",NORTHWEST INST PLATEAU BIO CAS; 中国科学院西北高原生物研究所,"WEI LIXIN;  JIANG LEI;  BI HONGTAO;  XIAO YUANCAN;  ZHOU WENBIN;  LI CAIXIA;  GUAN SHUHAN;  LI TIANCAI;  ZHANG MING; 魏立新, ; 江磊, ; 毕洪涛, ; 肖远灿, ; 周文斌, ; 李彩霞, ; 关舒函, ; 李天才, ; 张明",20250421,20250421,20250725,,,,,,2025,2025
,Screen interactive learning method and system based on artificial intelligence,"
                        ",BEIJING HUAKE ZHONGHE TECH CO LTD; 北京华科众合科技有限公司,"WANG YIBIAO;  XUE TING; 王奕标, ; 薛婷",20250310,20250310,20250725,,,,,,2025,2025
,Asset creation using generative artificial intelligence,"
                        ","SONY INTERACTIVE ENTERTAINMENT INC;  SONY INTERACTIVE ENTERTAINMENT LLC; 索尼互动娱乐股份有限公司, ; 索尼互动娱乐有限责任公司","TINKLENBERG BJU RN;  ZHANG ERIC Y;  VOIGT TOBIAS;  ALDANA VICTOR; B·廷克伦伯格, ; E·Y·张, ; T·福格特, ; V·阿尔达纳",20240123,20250123,20250725,,,,,,2025,2025
,Property work planning method and device based on artificial intelligence technology,"
                        ",BEIJING XINKETONG TECH CO LTD; 北京新客通科技有限公司,SHI NINGNING; 石宁宁,20250415,20250415,20250725,,,,,,2025,2025
,Knowledge graph construction via generative artificial intelligence,"
                        ",GE PRECISION MEDICINE LLC; 通用电气精准医疗有限责任公司,"MADHAVAN SESHADRI;  NARAYANA REDDY GARI RAMAN KUMAR REDDY;  MATTCHAVARUCATIL MATTHIEU; S·马达范, ; R·K·R·纳拉亚纳雷迪加里, ; 马修斯·马特森查瓦鲁卡提尔",20240125,20241220,20250725,,,,,,2025,2024
,Servo drive processing method and system based on artificial intelligence,"
                        ",ZHEJIANG DEALOUR ELECTRIC TECH CO LTD; 浙江德欧电气技术股份有限公司,"ZHANG YING;  LI FEI;  WANG SHAOFEI;  PAN ANYUAN;  ZHANG HUI;  FANG LEI;  LI YUANSHENG; 张颖, ; 李飞, ; 王少飞, ; 潘安远, ; 章辉, ; 方磊, ; 李院生",20250403,20250403,20250725,,,,,,2025,2025
,Display article auditing method and system based on artificial intelligence,"
                        ",SHENZHEN QINSILK TECH CO LTD; 深圳市秦丝科技有限公司,"LIU YONG;  HUANG JIANTAO; 刘勇, ; 黄键涛",20250626,20250626,20250725,,,,,,2025,2025
,Agricultural inspection robot based on artificial intelligence technology,"
                        ",BEIJING DAHEDA TECH CO LTD; 北京达禾达科技有限公司,"WANG HONGBO;  TANG CAN; 王洪波, ; 汤灿",20250401,20250401,20250725,,,,,,2025,2025
,Indoor skiing safety system based on artificial intelligence,"
                        ",UNIV HARBIN SPORT; 哈尔滨体育学院,"CAI GUOLIANG;  SUN JIAJIE;  HAN SONGYANG;  ZHANG YING;  ZHAO CHENQIONG;  WU FENGYU;  LIU GUOLIANG;  YAO YUAN;  LIU XIA;  WU MEILING; 蔡国梁, ; 孙佳杰, ; 韩松洋, ; 张颖, ; 赵晨琼, ; 武俸羽, ; 刘国良, ; 姚远, ; 刘侠, ; 武美玲",20250409,20250409,20250725,,,,,,2025,2025
,Emergency resource dynamic scheduling method and system based on artificial intelligence,"
                        ",GUANGZHOU TENSION INFORMATION TECH CO LTD; 广州天辰信息科技有限公司,"ZHANG WENBO;  HUANG GUOHUA;  CHEN JIANWEI; 张文博, ; 黄国华, ; 陈剑伟",20250409,20250409,20250725,,,,,,2025,2025
,MES system production process intelligent optimization method and system based on artificial intelligence,"
                        ",SUZHOU YUNDOU INFORMATION TECH CO LTD; 苏州云豆信息科技有限公司,TENG XINQUAN; 腾新权,20250328,20250328,20250725,,,,,,2025,2025
,Multi-environment self-adaptive refrigeration control system based on artificial intelligence,"
                        ",ZHEJIANG INNO THERMAL TECH CO LTD; 浙江英诺绿能科技有限公司,"GU ZHONG;  ZHAN GUOQIANG;  XIA YUQING;  YUE XUELI;  CHEN XUSHENG;  WU RUOYU; 顾众, ; 詹国强, ; 夏雨晴, ; 岳雪利, ; 陈旭升, ; 吴若愚",20250626,20250626,20250725,,,,,,2025,2025
,"Artificial intelligence algorithm model evaluation method, platform, device, medium and equipment","
                        ",MOMENTA SUZHOU TECH CO LTD; 魔门塔（苏州）科技有限公司,"LI MUYUN;  LIN YING;  LIU YUEHU;  YANG CHUNLIN;  QU TIANHANG; 李牧昀, ; 林影, ; 刘跃虎, ; 杨春林, ; 屈天航",20240123,20240123,20250725,,,,,,2025,2024
,Social game recommendation method and system based on artificial intelligence,"
                        ",SHENZHEN DUIDUI TECH CO LTD; 深圳对对科技有限公司,YANG RUI; 杨瑞,20250620,20250620,20250725,,,,,,2025,2025
,Access control method and system based on artificial intelligence and Internet of Things,"
                        ",SHENZHEN BOSINY ELECTRONICS CO LTD; 深圳市博西尼电子有限公司,WANG NIANJIONG; 王年炯,20250611,20250611,20250725,,,,,,2025,2025
,Building energy consumption analysis method and system based on artificial intelligence,"
                        ",ZHEJIANG NENGGONG CONSTRUCTION GROUP CO LTD; 浙江能工建设集团有限公司,"TAO JIANFEI;  ZHANG SHANFANG;  MA QIANGFENG;  CHU JINGHUA;  WANG XIAOFENG;  YU TING;  CHEN WEI;  ZHANG GUOQIANG;  LI LONG;  LU FENG;  WANG BINFENG;  YANG FANGHUA;  FANG FENGHUI;  XIA SHUXIANG;  SUN JIAYANG;  WANG WEIJIE;  TAO LIHAO;  ZHANG JIANMING; 陶建飞, ; 张善芳, ; 马强锋, ; 褚竞骅, ; 王晓峰, ; 俞婷, ; 陈伟, ; 张国强, ; 李龙, ; 陆峰, ; 王斌锋, ; 杨芳华, ; 方枫慧, ; 夏书祥, ; 孙嘉阳, ; 王伟杰, ; 陶李豪, ; 张建明",20250421,20250421,20250725,,,,,,2025,2025
,Household health early warning method based on artificial intelligence and related equipment,"
                        ",UNIV PEKING 3RD HOSPITAL PEKING UNIV 3RD CLINICAL MEDICAL COLLEGE; 北京大学第三医院（北京大学第三临床医学院）,"SHI YANYAN;  ZHANG HUA;  ZHAN SIYAN;  LI YUETIAN;  SONG YAHAN; 石岩岩, ; 张华, ; 詹思延, ; 李阅天, ; 宋涯含",20250409,20250409,20250725,,,,,,2025,2025
,Supplier management system based on artificial intelligence,"
                        ",DINGHAN TECH CO LTD; 鼎函科技有限公司,"CHEN HAITAO;  LIU YANG; 陈海涛, ; 刘洋",20250414,20250414,20250725,,,,,,2025,2025
,Laminated structure material electromagnetic performance design method and system based on artificial intelligence,"
                        ",NAT UNIV DEFENSE TECHNOLOGY PLA; 中国人民解放军国防科技大学,"DUAN KE;  YANG NAIFENG;  HE YONGLYU;  JU SU;  WU NAN;  XING SULI;  ZHANG JIANWEI;  CHEN DINGDING;  TANG JUN;  YIN CHANGPING;  ZHAO YIMING; 段科, ; 杨乃锋, ; 贺雍律, ; 鞠苏, ; 吴楠, ; 邢素丽, ; 张鉴炜, ; 陈丁丁, ; 唐俊, ; 尹昌平, ; 赵一鸣",20250626,20250626,20250725,,,,,,2025,2025
