patent_id,title,abstract,assignee,inventor_author,priority_date,filing_date,publication_date,grant_date,result_link,image_link,language,technology_category,publication_year,filing_year
,TEMPORALLY CONSISTENT AND SEMANTICS GUIDED TEXT-BASED VIDEO EDITING GENERATIVE ARTIFICIAL INTELLIGENCE (AI) MODEL WITH IMPROVED INITIALIZATION,"
                        ",QUALCOMM INC [US]; QUALCOMM Incorporated,"PARK HYOJIN [US];  DAS DEBASMIT [US];  HAYAT MUNAWAR [US];  PORIKLI FATIH MURAT [US]; PARK, Hyojin, ; DAS, Debasmit, ; HAYAT, Munawar, ; PORIKLI, Fatih Murat",20240206,20240206,20250807,,,,,,2025,2024
,SYSTEMS AND METHODS FOR USING ARTIFICIAL INTELLIGENCE TO AUDIT INVOICES AND RESOLVE BILLING COMPLIANCE ISSUES,"
                        ","HEWLETT JR JOHN REED [US]; HEWLETT, JR. John Reed","HEWLETT JR JOHN REED [US]; HEWLETT, JR., John Reed",20240205,20250130,20250807,,,,,,2025,2025
,METHOD AND SYSTEM USING ARTIFICIAL INTELLIGENCE FOR PREDICTING AGEING IMPACT OF LOADING ON DISTRIBUTION TRANSFORMERS,"
                        ",SAUDI ARABIAN OIL CO [SA]; SAUDI ARABIAN OIL COMPANY,"ALSHAMMARI KHALED MUBARAK [SA];  ALHARBI FAHAD QAED [SA];  TAKROUNI ABDULRAHMAN [SA]; Alshammari, Khaled Mubarak, ; Alharbi, Fahad Qaed, ; TAkrouni, Abdulrahman",20240206,20240206,20250807,,,,,,2025,2024
,METHOD AND ELECTRONIC DEVICE FOR TRAINING ARTIFICIAL INTELLIGENCE MODEL FOR INFERRING POSITION INFORMATION,"
                        ","SAMSUNG ELECTRONICS CO LTD [KR]; Samsung Electronics Co., Ltd","HWANGBO HOON [KR]; HWANGBO, Hoon",20221025,20250423,20250807,,,,,,2025,2025
,ARTIFICIAL INTELLIGENCE-BASED SYSTEM AND METHOD FOR AUTOMATING JOB MATCHING,"
                        ",MYQUICKHR SDN BHD [MY]; myQuickHR Sdn Bhd,"RABINDRAN RAVINDRAN [MY];  AB KADIR @ MOHD KHADIR ROZIHA [MY];  KOK TRACY SWEE LIN [MY]; Rabindran, Ravindran, ; Ab Kadir @ Mohd Khadir, Roziha, ; Kok, Tracy Swee Lin",20240202,20240313,20250807,,,,,,2025,2024
,Multi-Sourced Machine Learning Model-Based Artificial Intelligence Character Training and Development,"
                        ","DISNEY ENTPR INC [US]; Disney Enterprises, Inc","PAETZEL-PRUESMANN MAIKE [CH];  LEHMAN JILL FAIN [US];  BASH STEPHEN [US];  KENNEDY JAMES R [US];  GOMEZ CELIA [US]; Paetzel-Pruesmann, Maike, ; Lehman, Jill Fain, ; Bash, Stephen, ; Kennedy, James R, ; Gomez, Celia",20240205,20240205,20250807,,,,,,2025,2024
,SELF-IMPROVING ARTIFICIAL INTELLIGENCE PROGRAMMING,"
                        ","QUALCOMM TECHNOLOGIES INC [US]; QUALCOMM Technologies, Inc","COHEN TACO SEBASTIAAN [NL];  RAINONE CORRADO [NL];  MANCZAK BLAZEJ JAKUB [NL];  ZHANG WEI DAVID [NL];  DEFFERRARD MICHAEL [CH];  BUTT NATASHA [US]; COHEN, Taco Sebastiaan, ; RAINONE, Corrado, ; MANCZAK, Blazej Jakub, ; ZHANG, Wei David, ; DEFFERRARD, Michael, ; BUTT, Natasha",20240201,20240201,20250807,,,,,,2025,2024
,SYSTEMS AND METHODS FOR USING ARTIFICIAL INTELLIGENCE AND MACHINE LEARNING TO GENERATE OPTIMIZED OPERATING PARAMETERS FOR A WORK TOOL BASED ON TRACK HAPTIC FEEDBACK AND QUALITY OF JOB PERFORMED,"
                        ",BLUEFORGE ALLIANCE [US]; BlueForge Alliance,"KRAVITZ ARNOLD [US]; Kravitz, Arnold",20231207,20250423,20250807,,,,,,2025,2025
,Artificial Intelligence - Blockchain Regulatory and Compliance Engine,"
                        ",TEACHERS INSURANCE AND ANNUITY ASS OF AMERICA [US]; TEACHERS INSURANCE AND ANNUITY ASSOCIATON OF AMERICA,"DURVASULA SASTRY VSM [US];  SINGH SWATEE [US];  ALMASAN RARES IOAN [US];  POLA VAMSI [US]; Durvasula, Sastry Vsm, ; Singh, Swatee, ; Almasan, Rares Ioan, ; Pola, Vamsi",20240206,20240206,20250807,,,,,,2025,2024
,ARTIFICIAL INTELLIGENCE VIRTUAL ASSISTANT IN A PHYSICAL STORE,"
                        ","LOOP NOW TECH INC [US]; Loop Now Technologies, Inc, ; Loop Now Technologies, Inc.,","TU JEREMIAH KEVIN [US];  CHEN JING XIAN [US];  CHIU EDWIN [US];  LI WU-HSI [US];  LUK JERRY TING KWAN [US]; Tu, Jeremiah Kevin, ; Chen, Jing Xian, ; Chiu, Edwin, ; Li, Wu-Hsi, ; Luk, Jerry Ting Kwan",20230224,20250424,20250807,,,,,,2025,2025
,ON-DEVICE ARTIFICIAL INTELLIGENCE (AI) DEVICE OF PROVIDING MULTI-WAY INTERPRETATION SERVICE AND METHOD THEREOF,"
                        ","LX SEMICON CO LTD [KR]; LX SEMICON CO., LTD","LEE YUN TAE [KR]; LEE, Yun Tae",20240202,20250131,20250807,,,,,,2025,2025
,Applied Artificial Intelligence Technology for Narrative Generation Based on a Conditional Outcome Framework,"
                        ","SALESFORCE INC [US]; Salesforce, Inc","PALEY ANDREW R [US];  NICHOLS NATHAN D [US];  TRAHAN MATTHEW L [US];  LEWIS MEZA MAIA [US];  PHAM MICHAEL TIEN THINH [US];  TRUONG CHARLIE M [US]; Paley, Andrew R, ; Nichols, Nathan D, ; Trahan, Matthew L, ; Lewis Meza, Maia, ; Pham, Michael Tien Thinh, ; Truong, Charlie M",20170217,20250428,20250807,,,,,,2025,2025
,METHOD AND SYSTEM FOR ARTIFICIAL INTELLIGENCE ASSISTED CONTENT LIFECYCLE MANAGEMENT,"
                        ","JPMORGAN CHASE BANK NA [US]; JPMorgan Chase Bank, N.A","THOMAS W DAVID [US];  DULKINA MARIANNA [US];  MCNAMARA KEVIN J [US];  NOVAK BEN [US];  HOUDESHELL MICHAEL [US];  KATSMA KENNETH [US];  MACIAS MARIO [US];  GUPTA PREETI [US];  SAVIC DEJAN [US];  PARK ELIZABETH [US];  TALREJA ROHIT [IN];  MURALI ANJANA [US]; THOMAS, W David, ; DULKINA, Marianna, ; MCNAMARA, Kevin J, ; NOVAK, Ben, ; HOUDESHELL, Michael, ; KATSMA, Kenneth, ; MACIAS, Mario, ; GUPTA, Preeti, ; SAVIC, Dejan, ; PARK, Elizabeth, ; TALREJA, Rohit, ; MURALI, Anjana",20240201,20240315,20250807,,,,,,2025,2024
,ARTIFICIAL INTELLIGENCE AND CONTENT DELIVERY DURING CHARGING,"
                        ","TOYOTA MOTOR NORTH AMERICA INC [US];  TOYOTA MOTOR CO LTD [JP]; TOYOTA MOTOR NORTH AMERICA, INC, ; TOYOTA JIDOSHA KABUSHIKI KAISHA","YANG CHRISTOPHER E [US];  GAITHER GEOFFREY DAVID [US];  SWARTZ JAMES G [US];  WILDER JAMES D [US];  MAU FREDERICK W [US]; Yang, Christopher E, ; Gaither, Geoffrey David, ; Swartz, James G, ; Wilder, James D, ; Mau, Frederick W",20240202,20250114,20250807,,,,,,2025,2025
,SYNTHETIC DATA GENERATION METHOD FOR TRAINING ARTIFICIAL INTELLIGENCE MODEL AND CLIENT APPARATUS,"
                        ",CUBIG CORP [KR]; Cubig Corp,"CHUNG MIN CHAN [KR]; CHUNG, Min Chan",20240205,20250128,20250807,,,,,,2025,2025
,ARTIFICIAL INTELLIGENCE-BASED QUERY GENERATION FOR CYBERSECURITY DATA SEARCH,"
                        ",GOOGLE LLC [US]; Google LLC,"LICHTENSTEIN SPENCER DANIEL [US];  WAWDA ABUBAKAR [US];  NAGHIBZADEH SHAPOR [US]; Lichtenstein, Spencer Daniel, ; Wawda, Abubakar, ; Naghibzadeh, Shapor",20240202,20240202,20250807,,,,,,2025,2024
,ARTIFICIAL INTELLIGENCE DRIVEN DOMAIN-SPECIFIC VALIDATION SYSTEM,"
                        ","WELLS FARGO BANK NA [US]; Wells Fargo Bank, N.A","SINGH RAHUL [US];  DEB DIPANJAN [IN];  JESWANI KARAN [IN];  PUPPALA RIDHI [IN];  ACHACHLOUEI MOHAMMAD AHMADI [US];  IYER ANAND [IN];  BEHRE ADARSH [IN]; Singh, Rahul, ; Deb, Dipanjan, ; Jeswani, Karan, ; Puppala, Ridhi, ; Achachlouei, Mohammad Ahmadi, ; Iyer, Anand, ; Behre, Adarsh",20240206,20250205,20250807,,,,,,2025,2025
,ON-DEVICE ARTIFICIAL INTELLIGENCE PROCESSING DISTRIBUTED PROCESSING DEVICE AND METHOD,"
                        ","LX SEMICON CO LTD [KR]; LX SEMICON CO., LTD","LEE YUN TAE [KR]; LEE, Yun Tae",20240202,20250131,20250807,,,,,,2025,2025
,SYSTEM AND METHOD FOR INTEGRATING ARTIFICIAL INTELLIGENCE ASSISTANTS WITH WEBSITE BUILDING SYSTEMS,"
                        ",WIX COM LTD [IL]; Wix.com Ltd,"AVIYAM YUVAL [IL];  DAR ORON [IL];  KEREN RON [IL];  BEN SIMON YANIV [IL]; AVIYAM, Yuval, ; DAR, Oron, ; KEREN, Ron, ; BEN SIMON, Yaniv",20240207,20241030,20250807,,,,,,2025,2024
,GENERATIVE ARTIFICIAL INTELLIGENCE FRAMEWORK WITH SPECIALIZATION VIA SIMULATED HISTORY GENERATION,"
                        ","INSIGHT DIRECT USA INC [US]; Insight Direct USA, Inc","BRENNER DAVID [US];  MCCURDY DAVID [US]; Brenner, David, ; McCurdy, David",20240202,20250203,20250807,,,,,,2025,2025
,METHOD AND SYSTEM FOR GENERATING RECOMMENDATIONS USING GENERATIVE ARTIFICIAL INTELLIGENCE (AI) MODEL,"
                        ",HCL TECHNOLOGIES LTD [IN]; HCL Technologies Limited,"AHLAWAT ROHIT [US];  CHIRANKUMARATH RAJESH KRISHNAN [US];  SHARMA SACHIDANAND [US];  NVN RAJU [CA]; Ahlawat, Rohit, ; Chirankumarath, Rajesh Krishnan, ; Sharma, Sachidanand, ; NVN, RAJU",20240207,20240419,20250807,,,,,,2025,2024
,QUERY RESOLUTION USING CODEBASE ANALYSIS AND GENERATIVE ARTIFICIAL INTELLIGENCE MODELS,"
                        ",APPLAND INC [US]; AppLand Inc,"LAWLER ELIZABETH [US];  GILPIN KEVIN [US];  BYRNE DUSTIN [US]; Lawler, Elizabeth, ; Gilpin, Kevin, ; Byrne, Dustin",20240201,20240509,20250807,,,,,,2025,2024
,Artificial Intelligence (AI) on an Edge Network,"
                        ","AKAMAI TECH INC [US]; Akamai Technologies, Inc","CHAMPAGNE ANDREW F [US];  MERIDITH MICHAEL [US];  GERO CHARLES E [US];  IYER RAMANATH [US]; Champagne, Andrew F, ; Meridith, Michael, ; Gero, Charles E, ; Iyer, Ramanath",20240203,20250203,20250807,,,,,,2025,2025
,METHODS AND APPARATUSES FOR TRANSMITTING NEURAL NETWORK PARAMETERS FOR ARTIFICIAL INTELLIGENCE OR MACHINE LEARNING MODEL TRAINING,"
                        ","HUAWEI TECH CO LTD [CN]; Huawei Technologies Co., Ltd","TANG HAO [CA];  ZHANG LIQING [CA];  MA JIANGLEI [CA]; Tang, Hao, ; Zhang, Liqing, ; Ma, Jianglei",20221206,20250425,20250807,,,,,,2025,2025
,ARTIFICIAL INTELLIGENCE SYSTEM FOR MEDIA ITEM RECOMMENDATIONS,"
                        ",GOOGLE LLC [US]; Google LLC,"KHANI NIKHIL [US];  KULA MACIEJ [US];  KAHN JARROD [US];  NATH ANIRUDDH [US];  YANG SHUO [US];  LIU YANG [US];  ABBO PENDO [US];  WEI LI [US];  ANDREWS SHAWN [US];  ZHAO ZHE [US];  HONG LICHAN [US];  CHI ED [US]; Khani, Nikhil, ; Kula, Maciej, ; Kahn, Jarrod, ; Nath, Aniruddh, ; Yang, Shuo, ; Liu, Yang, ; Abbo, Pendo, ; Wei, Li, ; Andrews, Shawn, ; Zhao, Zhe, ; Hong, Lichan, ; Chi, Ed",20240207,20250207,20250807,,,,,,2025,2025
,NETWORK ARCHITECTURE FOR ARTIFICIAL INTELLIGENCE MODEL PROTECTION,"
                        ",INTEL CORP [US]; Intel Corporation,"CHEN LUHAI [CN];  ZHU BING [CN];  SMITH NED M [US];  HUANG YANG [CN];  YAN SHAOPU [CN];  ZHAO XUEYAN [CN];  AERRABOTU NAVEEN [US]; Chen, Luhai, ; Zhu, Bing, ; Smith, Ned M, ; Huang, Yang, ; Yan, Shaopu, ; Zhao, Xueyan, ; Aerrabotu, Naveen",20220701,20220701,20250807,,,,,,2025,2022
,SYSTEMS AND METHODS FOR PROVIDING ON-DEMAND ACCESS TO RESOURCES ACROSS GLOBAL OR CLOUD COMPUTER NETWORKS USING ARTIFICIAL INTELLIGENCE MODELS,"
                        ","CITIBANK NA [US]; Citibank, N.A","DE CASTRO MARCHESE JOAO PAULO [US];  OLOMO CHRISTOPHER OPEYEMI [IE];  PERENHA BACCALA LEONARDO [US];  SICA VALERIA ALEJANDRA [US]; De Castro Marchese, Joao Paulo, ; Olomo, Christopher Opeyemi, ; Perenha Baccala, Leonardo, ; Sica, Valeria Alejandra",20240206,20250303,20250807,,,,,,2025,2025
,ARTIFICIAL INTELLIGENCE AI SERVICE PROCESSING METHOD AND DEVICE,"
                        ","VIVO MOBILE COMMUNICATION CO LTD [CN]; VIVO MOBILE COMMUNICATION CO., LTD","ZHOU TONG [CN];  YUAN YANNAN [CN]; ZHOU, Tong, ; YUAN, Yannan",20221107,20250428,20250807,,,,,,2025,2025
,METHOD APPARATUS AND PROGRAM FOR IDENTITY DETERMINATION BASED ON ARTIFICIAL INTELLIGENCE,"
                        ",PINOKIO LAB CORP [KR]; 피노키오랩 주식회사,"CHO YONG SUK;  LEE SUNG EUI; 조용석, ; 이성의",20240123,20240123,20250730,,,,,,2025,2024
,Augmented reality guitar performance using artificial intelligence-based hand gesture recognition algorithm,"
                        ",UNIV HOSEO ACAD COOP FOUND [KR]; 호서대학교 산학협력단,"GEONGGI LEE;  JUN LEE; 이정기, ; 이준",20240123,20240123,20250730,,,,,,2025,2024
,ELECTRONIC DEVICE CONTROL METHOD AND COMPUTER PROGRAM GENERATING LEARNING DATA FOR ARTIFICIAL INTELLIGENCE MODEL ABOUT LAPAROSCOPIC SURGERY BY GENERATING VIRTUAL SURGERY IMAGES BASED ON LAPAROSCOPIC SURGERY IMAGES AND SURGICAL TOOL IMAGES,"
                        ",UNIV HALLYM IACF [KR]; 한림대학교 산학협력단,"KWON JAE HYUN;  CHO BUM JOO;  PARK TAE YONG;  KIM SO EUI; 권재현, ; 조범주, ; 박태용, ; 김소의",20240123,20240123,20250730,,,,,,2025,2024
,METHOD FOR DIAGNOSING FAULTS IN POWER FACILITIES BASED ON ARTIFICIAL INTELLIGENCE INCLUDING AUTOMATIC MODEL GENERATION,"
                        ",KOREA ELECTRIC POWER CORP [KR]; 한국전력공사,"JANG SEUNG MIN [KR];  SON SEUNG WOO [KR];  KIM BONG SUCK [KR];  PARK SOO MAN [KR];  WOO SANG KYUN [KR]; 장승민, ; 손승우, ; 김봉석, ; 박수만, ; 우상균",20220721,20250722,20250730,,,,,,2025,2025
,Artificial intelligence-based customer emotion analysis and customized support system,"
                        ",DAEN [KR]; (주)다엔,LEE JAE HYUN [KR]; 이재현,20241113,20241113,20250730,,,,,,2025,2024
,Real-time Dynamic Pricing System Using Artificial Intelligence,"
                        ",DAEN [KR]; (주)다엔,LEE JAEHYUN; 이재현,20241025,20241025,20250730,,,,,,2025,2024
,METHOD AND SYSTEM FOR AUTOMATIC MATCHING BETWEEM CONTENT CREATORS AND COMPANIES BASED ON ARTIFICIAL INTELLIGENCE,"
                        ",RATEL & PARTNERS CO LTD [KR]; 주식회사 라텔앤드파트너즈,CHOI NAMHEE; 최남희,20241030,20241030,20250730,,,,,,2025,2024
,METHOD COMPUTING DEVICE AND COMPUTER PROGRAM FOR GENERATING DEPTH MAP BASED ON POINT CLOUD USING ARTIFICIAL INTELLIGENCE,"
                        ","RIDEFLUX INC [KR];  POSTECH RES & BUSINESS DEV FOUND [KR]; 주식회사 라이드플럭스, ; 포항공과대학교 산학협력단","JEONG HA WOOK [KR];  KIM JI WOONG [KR];  YANG YU JIN [KR];  KIM BEOM JUN [KR];  JUNG MIN WOO [KR];  OH TAE HYUN [KR];  LEE HYO SEOK [KR];  KIM KYEONG SEON [KR];  KWON BYUNG KI [KR]; 정하욱, ; 김지웅, ; 양유진, ; 김범준, ; 정민우, ; 오태현, ; 이효석, ; 김경선, ; 권병기",20241126,20241126,20250730,,,,,,2025,2024
,A METHOD FOR IDENTIFYING AUTHENTICATION BOUYS BASED ON ARTIFICIAL INTELLIGENCE MODELS AND THE ELECTRONIC DEVICE PERFORMING THEREOF,"
                        ","OUR SEA OF EAST ASIA NETWORK [KR];  LIM SE HAN [KR]; (사)동아시아바다공동체 오션, ; 임세한","HONG SUN WOOK [KR];  LIM SE HAN [KR];  JUNG HO SEUNG;  KIM RYEONG GYU;  HAN GOOK IN; 홍선욱, ; 임세한, ; 정호승, ; 김령규, ; 한국인",20240717,20240717,20250718,,,,,,2025,2024
,APPARATUS AND METHOD OF REPOSITIONING DRUGS BASED ON ARTIFICIAL INTELLIGENCE LEARNING,"
                        ",UNIV DONGGUK IND ACAD COOP [KR]; 동국대학교 산학협력단,"LIM SANG SOO;  LEE SUNG KYUNG;  JEON JIN A;  KIM YAE WON;  AN HYE RIN; 임상수, ; 이성경, ; 전진아, ; 김예원, ; 안혜린",20240111,20240111,20250718,,,,,,2025,2024
,Artificial intelligence-based inventory management system,"
                        ",THE ENDLESS CONNECTION CO LTD [KR]; 주식회사 더엔들러스커넥션,"KANG DAN [KR];  CUI QINGHE [CN];  JIANG WEI [CN]; 강단, ; 최청학, ; 강 유",20241101,20241101,20250718,,,,,,2025,2024
,METHOD FOR PROVIDING EVIDENCE MANAGEMENT AND INFORMATION INQUIRY SOLUTION FOR SECURITY COMPLIANCE OF ARTIFICIAL INTELLIGENCE MODEL-BASED INFORMATION PROTECTION,"
                        ",MANYIN SOFT CO LTD [KR]; 메니인소프트(주),LEE JEONG YONG [KR]; 이정용,20241227,20241227,20250718,,,,,,2025,2024
,Method device and system for providing optimization solutions for manufacturing processes using artificial intelligence models linked to vision processing for manufacturing results,"
                        ",SMTVISION COPORATION [KR]; 주식회사 에스엠티비전,KIM DONG YUN [KR]; 김동윤,20241209,20241209,20250718,,,,,,2025,2024
,NFT METHOD AND SYSTEM FOR PROVIDING SERVICE OF ARTIFICIAL INTELLIGENCE-BASED PROJECT MATCHING AND CAREER CERTIFICATION NFT ISSUANCE THROUGH JOB SEEKER PROFILE INPUT INFORMATION,"
                        ",SONG JAE BOK [KR]; 송재복,"SONG JAE BOK [KR];  LIM HYEONG TAK;  DO HA SEOK; 송재복, ; 임형탁, ; 도하석",20240111,20240111,20250721,,,,,,2025,2024
,ARTIFICIAL INTELLIGENCE BASED SOLAR POWER GENERATION ENERGY PREDICTION SYSTEM AND METHOD USING WEATHER INFORMATION,"
                        ",YEUNGJIN COLLEGE IND ACADEMY COOPERATION [KR]; 영진전문대학 산학협력단,"JUNG TAE YOON;  SEO MIN SEONG; 정태윤, ; 서민성",20240112,20240112,20250721,,,,,,2025,2024
,MONITORING SYSTEM FOR SIMILAR PRODUCT BASED ON ARTIFICIAL INTELLIGENCE AND METHOD THEREOF,"
                        ",MARKCLOUD CO LTD [KR]; 주식회사 마크클라우드,JEONG SANG IL [KR]; 정상일,20240112,20240112,20250721,,,,,,2025,2024
,DIAGNOSTIC ASSISTANCE DEVICE AND METHOD FOR PREDICTING CONTINUOUS BLOOD PRESSURE WAVEFORM USING NON-INVASIVE PHOTOPLETHYSMOGRAPHY BASED ON ARTIFICIAL INTELLIGENCE MODEL,"
                        ","ASAN FOUND [KR];  UNIV ULSAN FOUND IND COOP [KR]; 재단법인 아산사회복지재단, ; 울산대학교 산학협력단","SUNG HOON KIM;  DONG KYU KIM;  HYUN SEOK KIM; 김성훈, ; 김동규, ; 김현석",20240112,20240112,20250721,,,,,,2025,2024
,METHOD DEVICE AND SYSTEM FOR PROVIDING MAINTENANCE SOLUTION OF INDUSTRIAL EQUIPMENT BASED ON GENERATIVE ARTIFICIAL INTELLIGENCE MODEL,"
                        ",SYSNER [KR]; 주식회사 시스너,SEO JIN SEOK [KR]; 서진석,20241105,20241105,20250721,,,,,,2025,2024
,APPARATUS AND METHOD OF CLASSIFYING AND DETECTING REAL-TIME ABNORMAL BEHAVIOR BASED ON ARTIFICIAL INTELLIGENCE,"
                        ",UNIV DONGGUK IND ACAD COOP [KR]; 동국대학교 산학협력단,"LIM SANG SOO;  KIM JUNG HYE;  CHOI JUN HO;  JUNG SEUNG HYEON; 임상수, ; 김정혜, ; 최준호, ; 정승현",20240111,20240111,20250721,,,,,,2025,2024
,Method Apparatus And System for Providing Safety Care Service Using Artificial Intelligence,"
                        ",NECTARSOFT CO LTD [KR]; (주)넥타르소프트,"KIM EUI GU;  KANG MYUNG JU;  KIM DONG-HO;  PARK SEONG HO [KR]; 김의구, ; 강명주, ; 김동호, ; 박성호",20240306,20240306,20250721,,,,,,2025,2024
,METHOD DEVICE AND SYSTEM FOR PROVIDING ANALYSIS RESULT OF MAINTENANCE NECESSITY OF INDUSTRIAL EQUIPMENT BASED ON GENERATIVE ARTIFICIAL INTELLIGENCE MODEL,"
                        ",SYSNER [KR]; 주식회사 시스너,SEO JIN SEOK [KR]; 서진석,20241105,20241105,20250721,,,,,,2025,2024
,System and Method for Providing Re-Identification Pedestrian Based on Artificial Intelligence,"
                        ",UNIV NAT INCHEON RES & BUSINESS FOUND [KR]; 인천대학교 산학협력단,JEON GWANG GIL; 전광길,20240117,20240117,20250724,,,,,,2025,2024
,AI METHOD APPARATUS AND SYSTEM FOR PROVIDING VIDEO SERVICE BASED ON TEXT RELAY USING GENERATIVE ARTIFICIAL INTELLIGENCE,"
                        ",LG UPLUS CORP [KR]; 주식회사 엘지유플러스,"JUNG HYUNG LOK;  CHOI BO HYUN;  KIM JOO YEON; 정형록, ; 최보현, ; 김주연",20240117,20240117,20250724,,,,,,2025,2024
,A SYSTEM AND METHOD FOR AUTOMATICALLY REVIEWING AND GRADING ENGLISH SENTENCES USING ARTIFICIAL INTELLIGENCE,"
                        ",NAM KI SUN [KR]; 남기선,"NAM KI SUN [KR];  KIM SEUNG HWAN [KR];  LEE YOON HO; 남기선, ; 김승환, ; 이윤호",20241007,20241007,20250724,,,,,,2025,2024
,ARTIFICIAL INTELLIGENCE-BASED MULTI-INTELLIGENCE ANALYSIS AND PERSONALIZED CAREER RECOMMENDATION SYSTEM,"
                        ",BEST TECH INC [KR]; 주식회사 베스트텍,"SEO WOO SEUNG;  KANG SEUNG IL; 서우승, ; 강승일",20240812,20240812,20250724,,,,,,2025,2024
,sLLM SYSTEM FOR AUTOMATICALLY GENERATING MULTIPLE SUB-TASKS FOR ANSWERING SINGLE QUESTION USING sLLM AND AUTOMATICALLY SELECTING MULTIPLE GENERATIVE ARTIFICIAL INTELLIGENCE MODELS ACCORDING TO PURPOSE OF DETAILED TASKS AND PROCESSING THEM IN PARALLEL,"
                        ",LINKBRICKS HORIZON AI INC [KR]; 주식회사 링크브릭스호라이즌에이아이,"JI YUN SUNG [KR];  KIM SANG KYU [KR]; 지윤성, ; 김상규",20250124,20250124,20250724,,,,,,2025,2025
,AI SYSTEM FOR PROVIDING COLLEGE ADMISSION PREDICTING SERVICE BASED ON ARTIFICIAL INTELLIGENCE AGENT,"
                        ",KIM DO KYUN [KR]; 김도균,KIM DO KYUN [KR]; 김도균,20240509,20240509,20250724,,,,,,2025,2024
,TECHNIQUE FOR DETERMINING TARGET DEVICE IN WHICH ARTIFICIAL INTELLIGENCE MODEL IS TO BE EXECUTED,"
                        ",NOTA INC [KR]; 주식회사 노타,PARK SANGGEON; 박상건,20240920,20240920,20250724,,,,,,2025,2024
,ARTIFICIAL INTELLIGENCE ANOMALY DETECTION USING X-RAY COMPUTED TOMOGRAPHY SCAN DATA,"
                        ","LUMAFIELD INC [US]; LUMAFIELD, INC","BASTIAN ANDREAS LINAS [US];  PIPE-MAZO DANIEL [US];  RUIZ-VARGAS CARLOS SAMUEL [US];  SANDMAN ANNE WINNEFELD [US]; BASTIAN Andreas Linas, ; PIPE-MAZO Daniel, ; RUIZ-VARGAS Carlos Samuel, ; SANDMAN Anne Winnefeld",20221019,20250416,20250801,,,,,,2025,2025
,Artificial intelligence robot,,"HYUNDAI MOTOR CO LTD [KR];  KIA CORP [KR]; Hyundai Motor Company, ; Kia Corporation","LEE JI A [KR];  LEE BYEONG CHEOL [KR];  KOO DONG HAN [KR]; Lee, Ji A, ; Lee, Byeong Cheol, ; Koo, Dong Han",20190528,20230314,20250805,,,,,,2025,2023
,"ECHOCARDIOGRAM ARTIFICIAL INTELLIGENCE PROCESSING SYSTEM, ECHOCARDIOGRAM ARTIFICIAL INTELLIGENCE PROCESSING METHOD AND COMPUTER PROGRAME PRODUCT",,UNIV CHINA MEDICAL [TW]; CHINA MEDICAL UNIVERSITY,"HSIEH KAI-SHENG [TW];  HUANG CHIH-CHUNG [TW];  HSU YU-LUNG [TW]; HSIEH, KAI-SHENG, ; HUANG, CHIH-CHUNG, ; HSU, YU-LUNG",20240223,20240223,20250521,,,,,,2025,2024
,Artificial intelligence driven fiber-optic bundle guided laser system,,"T TOP TECHNOLOGY OPTICAL CO LTD [TW];  PANG PEI CHUNG [TW]; T-TOP TECHNOLOGY OPTICAL CO., LTD, ; PANG, PEI-CHUNG","PANG PEI-CHUNG [TW]; PANG, PEI-CHUNG",20240229,20240229,20250511,,,,,,2025,2024
,INTERACTIVE ORAL CAVITY PHOTOGRAPHY SYSTEM AND ARTIFICIAL INTELLIGENCE IMAGE RECOGNITION ORAL CAVITY CANCER SCREENING METHOD USING THE SYSTEM,,"UNIV NAT TAIWAN [TW];  NATIONAL HEALTH RES INST [TW]; NATIONAL TAIWAN UNIVERSITY, ; NATIONAL HEALTH RESEARCH INSTITUTES","CHEN SHYH-JYE [TW];  LEE JANG-JAER [TW];  CHOU CHENG-YING [TW];  HUANG YU-CHENG [TW];  HSU YU [TW];  LEE JUN-CHING [TW];  CHEN HSIN-YU [TW];  ZHONG ZI-PING [TW];  LIN YONG-LONG [TW];  LIU YU-CHIEH [TW];  LIAO JUN-KAI [TW]; CHEN, SHYH-JYE, ; LEE, JANG-JAER, ; CHOU, CHENG-YING, ; HUANG, YU-CHENG, ; HSU, YU, ; LEE, JUN-CHING, ; CHEN, HSIN-YU, ; ZHONG, ZI-PING, ; LIN, YONG-LONG, ; LIU, YU-CHIEH, ; LIAO, JUN-KAI",20240401,20240919,20250501,,,,,,2025,2024
,"Energy-saving scheduling system and energy-saving scheduling method based on artificial intelligence
","
                        ","CHUNGHWA TELECOM CO LTD [TW]; CHUNGHWA TELECOM CO., LTD","KUNG BO-CHEN [TW]; KUNG, BO-CHEN",20231207,20231207,20250616,,,,,,2025,2023
,Radio access network service mediated enhanced session records for artificial intelligence or machine learning,"
                        ","NETSCOUT SYSTEMS INC [US]; NetScout Systems, Inc","FROEHLICH ROBERT WILLIAM [US];  LO WING F [US]; Froehlich, Robert William, ; Lo, Wing F",20200211,20220907,20250805,,,,,,2025,2022
,System for Monitoring Underpass flood based on Artificial Intelligence,"
                        ",NH NETWORKS LLC [KR]; 유한책임회사 엔에이치네트웍스,"LEE GEUN SIN;  LEE JONG SUN;  HONG WON TAEG; 이근신, ; 이종선, ; 홍원택",20240116,20240116,20250723,,,,,,2025,2024
,METHOD PROGRAM AND APPARATUS FOR GENERATING NEW PRODUCT IDEA BASED ON GENERATIVE ARTIFICIAL INTELLIGENCE,"
                        ",IMPACTIVE AI INC [KR]; (주)임팩티브에이아이,"CHUNG DOOHEE;  JUNG HEEWON;  OH INHYUK; 정두희, ; 정희원, ; 오인혁",20240116,20240312,20250723,,,,,,2025,2024
,METHOD AND DEVICE FOR EXPRESSING ARTIFICIAL INTELLIGENCE FEATURE DATA,"
                        ","ELECTRONICS & TELECOMMUNICATIONS RES INST [KR];  MYONGJI UNIV INDUSTRY AND ACADEMIA COOPERATION FOUNDATION [KR]; 한국전자통신연구원, ; 명지대학교 산학협력단","LEE JIN YOUNG [KR];  LEE HEE KYUNG [KR];  JUNG SOON HEUNG [KR];  KIM SANG KYUN [KR]; 이진영, ; 이희경, ; 정순흥, ; 김상균",20240116,20250115,20250723,,,,,,2025,2025
,APPARATUS AND METHOD FOR ASSISTING TREATMENT OF HYPERTENSIVE PATIENTS BASED ON ARTIFICIAL INTELLIGENCE MODEL,"
                        ","ASAN FOUND [KR];  UNIV ULSAN FOUND IND COOP [KR]; 재단법인 아산사회복지재단, ; 울산대학교 산학협력단","SOO JIN KANG;  HYEONYONG HAE; 강수진, ; 해현용",20240116,20240116,20250723,,,,,,2025,2024
,SYSTEM AND METHOD FOR PROVIDING FOREIGN LANGUAGE EDUCATION SERVICES USING ARTIFICIAL INTELLIGENCE,"
                        ",YOO EUN SOOK [KR]; 유은숙,YOO EUN SOOK [KR]; 유은숙,20250123,20250123,20250723,,,,,,2025,2025
,How to Calibrate Hydraulic Presses and Hydraulic Press Dimensions Using Artificial Intelligence Learning,"
                        ",MAXRING SOLUTION CO LTD [KR]; (주)맥스링솔루션,SUNG NAG MUN; 성낙문,20240115,20240115,20250722,,,,,,2025,2024
,Artificial intelligence-based power management control system,"
                        ",GANA ENG LTD [KR]; 가나이엔지 주식회사,KWAK SANG JONG; 곽상종,20240115,20240115,20250722,,,,,,2025,2024
,System And Method For Evaluating The Ethics Of Artificial Intelligence Models Using Self-Report Test,"
                        ",UNIV DONG A RES FOUND FOR IND ACAD COOP [KR]; 동아대학교 산학협력단,CHOI YOUNG LIM [KR]; 최영림,20240115,20250113,20250722,,,,,,2025,2025
