patent_id,title,abstract,assignee,inventor_author,priority_date,filing_date,publication_date,grant_date,result_link,image_link,language,technology_category,publication_year,filing_year
,Conception d’une solution de l’intelligence artificielle pour l’optimisation de la consommation d'énergie dans un quartier intelligent,"
                        ",UNIV HASSAN II DE CASABLANCA [MA]; Université Hassan II de Casablanca,"MOUSSAID LAILA [MA];  ABDELWAHAB HADDAOUI [MA]; MOUSSAID Laila, ; Abdelwahab HADDAOUI",20240304,20240304,20250930,,,,,,2025,2024
,"A METHOD OF, AND A SYSTEM FOR, OPTIMIZING COPYRIGHT PROTECTION WITHIN A GENERATIVE ARTIFICIAL INTELLIGENCE (AI) SYSTEM","
                        ",IAIAI TECH LIMITED [IE]; IAIAI TECHNOLOGIES LIMITED,MICHAEL KIELY [IE]; MICHAEL KIELY,20231101,20231101,20251008,,,,,,2025,2023
,PROCÉDÉ ET SYSTÈME INFORMATIQUES POUR APPLIQUER UNE INTELLIGENCE ARTIFICIELLE GÉNÉRATIVE À DES DONNÉES D'ASSURANCE,"
                        ","SEDGWICK CLAIMS MAN SERVICES INC [US]; SEDGWICK CLAIMS MANAGEMENT SERVICES, INC","COOPER LEAH [US];  FRIEDL JOSH [US];  CROSAS TIMOTHY [US];  SCHWEIZER DANIEL [US];  BROWNAWELL TIMOTHY [US]; COOPER, Leah, ; FRIEDL, Josh, ; CROSAS, Timothy, ; SCHWEIZER, Daniel, ; BROWNAWELL, Timothy",20240405,20250407,20251009,,,,,,2025,2025
,ASSISTANCE À UN UTILISATEUR DANS UNE EXPÉRIENCE DE RÉALITÉ MIXTE À L'AIDE D'UNE INTELLIGENCE ARTIFICIELLE GÉNÉRATIVE,"
                        ","SIMPLEAR INC [US]; SIMPLEAR, INC","VOLYN JULIAN [US];  DAVIS MICHAEL [US];  SOUTHARD TJ [US];  DO PHILLIP [US];  ZAVALETA JOSH [US];  WILLIAMS JAMES [US];  BROOKE MARLO [US];  TOPPEL SCOTT [US]; VOLYN, Julian, ; DAVIS, Michael, ; SOUTHARD, Tj, ; DO, Phillip, ; ZAVALETA, Josh, ; WILLIAMS, James, ; BROOKE, Marlo, ; TOPPEL, Scott",20240404,20250402,20251009,,,,,,2025,2025
,VALIDATION DE CONTENU ET DE FORMAT D'IMAGE À L'AIDE D'UNE INTELLIGENCE ARTIFICIELLE,"
                        ","CITIBANK NA [US]; CITIBANK, N.A","PALANIVEL SAKTHIVEL [US];  TROUT ASHLEIGH [US];  DUMANE SURENDRA GANGADHAR [US];  BORDON JENNIFER JOY [US];  MOHANTY ASHIM [US];  HUANG MONIQUE [US];  SILVER MIRIAM [US]; PALANIVEL, Sakthivel, ; TROUT, Ashleigh, ; DUMANE, Surendra Gangadhar, ; BORDON, Jennifer Joy, ; MOHANTY, Ashim, ; HUANG, Monique, ; SILVER, Miriam",20240402,20250326,20251009,,,,,,2025,2025
,PROCÉDÉ POUR MENER UNE SÉANCE CORRECTRICE DE DÉSENSIBILISATION SELON UN PROCÉDÉ DE DÉPLACEMENT DES YEUX EN UTILISANT UNE TECHNIQUE DE RÉALITÉ VIRTUELLE ET D'INTELLIGENCE ARTIFICIELLE,"
                        ","IVANOVA ELENA VALERIEVNA [RU]; ИВАНОВА, Елена Валериевна","IVANOVA ELENA VALERIEVNA [RU]; ИВАНОВА, Елена Валериевна",20240403,20250506,20251009,,,,,,2025,2025
,SYSTÈME ET MÉTHODE D'EXERCICE ORTHOPÉDIQUE ASSISTÉ PAR ROBOT BASÉS SUR L'INTELLIGENCE ARTIFICIELLE,"
                        ",CUREXO INC [KR]; 큐렉소 주식회사,"LEE CHAN HO [KR];  HWANG SUN HEE [KR];  LEE SANG HUN [KR];  KIM YOUNG HWAN [KR];  MOON JUN SIK [KR]; 이찬호, ; 황선희, ; 이상훈, ; 김영환, ; 문준식",20240401,20250203,20251009,,,,,,2025,2025
,SYSTÈME ET PROCÉDÉ D'ENTRAÎNEMENT ORTHOPÉDIQUE ASSISTÉ PAR ROBOT BASÉ SUR L'INTELLIGENCE ARTIFICIELLE,"
                        ",CUREXO INC [KR]; 큐렉소 주식회사,"HWANG SUN HEE [KR];  LEE SANG HUN [KR];  KIM YOUNG HWAN [KR];  MOON JUN SIK [KR]; 황선희, ; 이상훈, ; 김영환, ; 문준식",20240401,20250203,20251009,,,,,,2025,2025
,SYSTÈME MÉDICAL ET PROCÉDÉ POUR FOURNIR UN SERVICE D'ANALYSE DE DONNÉES BIOMÉTRIQUES PAR IA BASÉ SUR UNE INTELLIGENCE ARTIFICIELLE,"
                        ",MEDICAL AI CO LTD [KR]; 주식회사 메디컬에이아이,KWON JOONMYOUNG [KR]; 권준명,20240331,20250331,20251009,,,,,,2025,2025
,"SYSTÈME DE COMMUTATION DE MODÈLE D'INTELLIGENCE ARTIFICIELLE DE SIMULATION D'ANALYSE DE MODÈLE PHYSIQUE, ET PROCÉDÉ DE FONCTIONNEMENT DE SYSTÈME","
                        ",LG INNOTEK CO LTD [KR]; 엘지이노텍 주식회사,CHOI WOO JIN [KR]; 최우진,20240401,20250114,20251009,,,,,,2025,2025
,SYSTÈME ET PROCÉDÉ D'EXERCICE ORTHOPÉDIQUE ASSISTÉ PAR ROBOT BASÉ SUR L'INTELLIGENCE ARTIFICIELLE,"
                        ",CUREXO INC [KR]; 큐렉소 주식회사,"HWANG SUN HEE [KR];  LEE SANG HUN [KR];  KIM YOUNG HWAN [KR];  MOON JUN SIK [KR]; 황선희, ; 이상훈, ; 김영환, ; 문준식",20240401,20250203,20251009,,,,,,2025,2025
,SYSTÈME ET PROCÉDÉ DE DÉTERMINATION D'UN MODÈLE D'INTELLIGENCE ARTIFICIELLE POUR GÉNÉRER DES INFORMATIONS DE MOLÉCULE ACTIVE DE PROTÉINE CIBLE,"
                        ",GWANGJU INST SCIENCE & TECH [KR]; 광주과학기술원,"NAM HOJUNG [KR];  BAE BONG SUNG [KR]; 남호정, ; 배봉성",20240404,20240906,20251009,,,,,,2025,2024
,PROCÉDÉ ET APPAREIL DE TRAITEMENT DE GESTION DE FAISCEAU REPOSANT SUR L'INTELLIGENCE ARTIFICIELLE/APPRENTISSAGE AUTOMATIQUE DANS DES RÉSEAUX SANS FIL,"
                        ",SHARP KK [JP]; SHARP KABUSHIKI KAISHA,"LIN WAN-CHEN;  CHOU CHIE-MING;  LIN CHIA-HUNG;  SHIH MEI-JU;  LIU HE-HSUAN; LIN Wan-Chen, ; CHOU Chie-Ming, ; LIN Chia-Hung, ; SHIH Mei-Ju, ; LIU He-Hsuan",20240401,20250328,20251009,,,,,,2025,2025
,SYSTÈME ET PROCÉDÉ D'EXERCICE ORTHOPÉDIQUE ASSISTÉ PAR ROBOT BASÉ SUR L'INTELLIGENCE ARTIFICIELLE,"
                        ",CUREXO INC [KR]; 큐렉소 주식회사,"HWANG SUN HEE [KR];  LEE SANG HUN [KR];  KIM YOUNG HWAN [KR];  MOON JUN SIK [KR]; 황선희, ; 이상훈, ; 김영환, ; 문준식",20240401,20250203,20251009,,,,,,2025,2025
,PROCÉDÉ ET DISPOSITIF DE COLLECTE DE DONNÉES D'APPRENTISSAGE POUR UNE GESTION DE FAISCEAU SUR LA BASE D'UNE INTELLIGENCE ARTIFICIELLE ET D'UN APPRENTISSAGE AUTOMATIQUE DANS UN SYSTÈME DE COMMUNICATION SANS FIL,"
                        ","HYUNDAI MOTOR CO LTD [KR];  KIA CORP [KR]; 현대자동차주식회사, ; 기아주식회사","SUH YOUNG KIL [KR];  LEE JEONG SU [KR];  HONG UI HYUN [KR];  HAHN GENE BACK [KR]; 서영길, ; 이정수, ; 홍의현, ; 한진백",20240405,20250404,20251009,,,,,,2025,2025
,DISPOSITIF À BASE D'INTELLIGENCE ARTIFICIELLE ET PROCÉDÉ DE DÉTERMINATION DE LA POSITIVITÉ TEP AMYLOÏDE,"
                        ",SEOUL NAT UNIV HOSPITAL [KR]; 서울대학교병원,"KIM KI-WOONG [KR];  HAN JI WON [KR];  JO SUNGMAN [KR]; 김기웅, ; 한지원, ; 조성만",20240404,20250403,20251009,,,,,,2025,2025
,PROCÉDÉ ET APPAREIL DE TRANSFERT INTERCELLULAIRE UTILISANT UNE INTELLIGENCE ARTIFICIELLE DANS UN SYSTÈME DE COMMUNICATION SANS FIL,"
                        ",SAMSUNG ELECTRONICS CO LTD [KR]; 삼성전자 주식회사,"JEONG SEUNGBEOM [KR];  LEE TAESEOP [KR];  KANG HYUNJEONG [KR];  BAEK SANGKYU [KR]; 정승범, ; 이태섭, ; 강현정, ; 백상규",20240403,20250403,20251009,,,,,,2025,2025
,SYSTÈME D'INTELLIGENCE ARTIFICIELLE ET PROCÉDÉ DE PLACEMENT ET DE ROUTAGE DE NIVEAU DE TRANSISTOR DE CIRCUITS NUMÉRIQUES APLATIS,"
                        ",NEOLOGIC LTD [IL]; NEOLOGIC LTD,"MESSICA AVI [IL];  LESHEM ZIV [IL];  FAUST ARIE [IL];  TETRO ALON [IL]; MESSICA, Avi, ; LESHEM, Ziv, ; FAUST, Arie, ; TETRO, Alon",20240403,20250402,20251009,,,,,,2025,2025
,SYSTÈME DE PHOTOGRAPHIE BUCCALE INTERACTIF ET PROCÉDÉ DE RÉALISATION D'UN DÉPISTAGE DE CANCER BUCCAL PAR RECONNAISSANCE D'IMAGE AVEC L'INTELLIGENCE ARTIFICIELLE L'UTILISANT,"
                        ","CHEN SHYH JYE [CN];  TAIWAN HEALTH RES INSTITUTES [CN]; 陈世杰, ; 台湾卫生研究院","CHEN SHYH-JYE [CN];  LEE JANG-JAER [CN];  CHOU CHENG-YING [CN];  HUANG YU-CHENG [CN];  HSU YU [CN];  LEE JUN-CHING [CN];  CHEN HSIN-YU [CN];  ZHONG ZI-PING [CN];  LIN YONG-LONG [CN];  LIU YU-CHIEH [CN];  LIAO JUN-KAI [CN]; 陈世杰, ; 李正喆, ; 周呈霙, ; 黄裕城, ; 徐郁, ; 李俊庆, ; 陈信妤, ; 钟子平, ; 林永隆, ; 刘宇捷, ; 廖俊凯",20240401,20250327,20251009,,,,,,2025,2025
,PROCÉDÉS ET APPAREILS DE PRÉDICTION BASÉE SUR L'INTELLIGENCE ARTIFICIELLE (IA) POUR LA MOBILITÉ DÉCLENCHÉE PAR LA COUCHE 1/COUCHE 2 (L1/L2) (LTM),"
                        ",LENOVO BEIJING LTD [CN]; LENOVO (BEIJING) LIMITED,"WU LIANHAI [CN];  YAN LE [CN];  YUE RAN [CN]; WU, Lianhai, ; YAN, Le, ; YUE, Ran",20250124,20250124,20251009,,,,,,2025,2025
,PROCÉDÉ DE GESTION DE FAISCEAU BASÉ SUR L'INTELLIGENCE ARTIFICIELLE/APPRENTISSAGE AUTOMATIQUE ET DISPOSITIF DE COMMUNICATION SANS FIL,"
                        ",SHENZHEN TCL NEW TECH CO LTD [CN]; 深圳TCL新技术有限公司,"ZHANG DIDI [CN];  CHEN ZHE [CN]; 张笛笛, ; 陈喆",20240404,20240404,20251009,,,,,,2025,2024
,VALIDATION D'INFÉRENCE DE MODÈLE BASÉE SUR L'INTELLIGENCE ARTIFICIELLE CÔTÉ RÉSEAU,"
                        ","APPLE INC [US];  XU FANGLI [US]; APPLE INC, ; XU, Fangli","XU FANGLI [US];  SIROTKIN ALEXANDER [US];  KUO PING-HENG [US];  VENKATA NAVEEN KUMAR R PALLE [US];  HU HAIJING [US];  CHENG PENG [US];  ROSSBACH RALF [US];  CHEN YUQIN [US];  WU ZHIBIN [US]; XU, Fangli, ; SIROTKIN, Alexander, ; KUO, Ping-Heng, ; VENKATA, Naveen Kumar R Palle, ; HU, Haijing, ; CHENG, Peng, ; ROSSBACH, Ralf, ; CHEN, Yuqin, ; WU, Zhibin",20240403,20240403,20251009,,,,,,2025,2024
,RAPPORT DE PRÉCISIONS D'INFÉRENCE DE MODÈLES QUANTIFIÉS POUR SURVEILLANCE DE PERFORMANCE D'INTELLIGENCE ARTIFICIELLE OU D'APPRENTISSAGE AUTOMATIQUE,"
                        ","QUALCOMM INC [US];  LI QIAOYU [CN];  TAHERZADEH BOROUJENI MAHMOUD [US];  YOO TAESANG [US]; QUALCOMM INCORPORATED, ; LI, Qiaoyu, ; TAHERZADEH BOROUJENI, Mahmoud, ; YOO, Taesang","LI QIAOYU [US];  TAHERZADEH BOROUJENI MAHMOUD [US];  YOO TAESANG [US]; LI, Qiaoyu, ; TAHERZADEH BOROUJENI, Mahmoud, ; YOO, Taesang",20240402,20240402,20251009,,,,,,2025,2024
,INDICATION DE SIMILARITÉ ENTRE DES CONDITIONS DE RÉSEAU PENDANT L'APPRENTISSAGE ET PENDANT L'INFÉRENCE AVEC DES MODÈLES D'INTELLIGENCE ARTIFICIELLE/APPRENTISSAGE AUTOMATIQUE (IA/ML) CÔTÉ ÉQUIPEMENT UTILISATEUR (UE),"
                        ","QUALCOMM INC [US];  PEZESHKI HAMED [US];  TAHERZADEH BOROUJENI MAHMOUD [US];  LI QIAOYU [CN]; QUALCOMM INCORPORATED, ; PEZESHKI, Hamed, ; TAHERZADEH BOROUJENI, Mahmoud, ; LI, Qiaoyu","PEZESHKI HAMED [US];  TAHERZADEH BOROUJENI MAHMOUD [US];  LI QIAOYU [US]; PEZESHKI, Hamed, ; TAHERZADEH BOROUJENI, Mahmoud, ; LI, Qiaoyu",20240404,20240404,20251009,,,,,,2025,2024
,PROCÉDÉS DE POSITIONNEMENT PAR INTELLIGENCE ARTIFICIELLE ET DISPOSITIF DE COMMUNICATION SANS FIL,"
                        ",SHENZHEN TCL NEW TECH CO LTD [CN]; 深圳TCL新技术有限公司,WU TIANQI [CN]; 邬天麒,20240405,20240405,20251009,,,,,,2025,2024
,"PROCÉDÉ ET APPAREIL DE TRAITEMENT BASÉ SUR L'INTELLIGENCE ARTIFICIELLE, DISPOSITIF ET SUPPORT DE STOCKAGE","
                        ",BEIJING XIAOMI MOBILE SOFTWARE CO LTD [CN]; 北京小米移动软件有限公司,YANG XING [CN]; 杨星,20240403,20240403,20251009,,,,,,2025,2024
,PRÉDICTION DE MESURE DE MODÈLE BASÉE SUR L'INTELLIGENCE ARTIFICIELLE CÔTÉ RÉSEAU,"
                        ","APPLE INC [US];  XU FANGLI [US]; APPLE INC, ; XU, Fangli","XU FANGLI [US];  SIROTKIN ALEXANDER [US];  HU HAIJING [US];  CHENG PENG [US];  KUO PING-HENG [US];  ROSSBACH RALF [US];  CHEN YUQIN [US];  WU ZHIBIN [US]; XU, Fangli, ; SIROTKIN, Alexander, ; HU, Haijing, ; CHENG, Peng, ; KUO, Ping-Heng, ; ROSSBACH, Ralf, ; CHEN, Yuqin, ; WU, Zhibin",20240403,20240403,20251009,,,,,,2025,2024
,INDICATIONS DE MODÈLE D'INTELLIGENCE ARTIFICIELLE PARMI DES CELLULES,"
                        ","QUALCOMM INC [US];  LI QIAOYU [CN];  LUO TAO [US];  TAHERZADEH BOROUJENI MAHMOUD [US];  PEZESHKI HAMED [US]; QUALCOMM INCORPORATED, ; LI, Qiaoyu, ; LUO, Tao, ; TAHERZADEH BOROUJENI, Mahmoud, ; PEZESHKI, Hamed","LI QIAOYU [US];  LUO TAO [US];  TAHERZADEH BOROUJENI MAHMOUD [US];  PEZESHKI HAMED [US]; LI, Qiaoyu, ; LUO, Tao, ; TAHERZADEH BOROUJENI, Mahmoud, ; PEZESHKI, Hamed",20240402,20240402,20251009,,,,,,2025,2024
,GESTION DE FAISCEAU BASÉE SUR L'INTELLIGENCE ARTIFICIELLE,"
                        ",ZTE CORP [CN]; ZTE CORPORATION,"AI JIANXUN [CN];  DONG FEI [CN];  LIU JING [CN]; AI, Jianxun, ; DONG, Fei, ; LIU, Jing",20240403,20240403,20251009,,,,,,2025,2024
,METHOD AND SYSTEM FOR PREDICTION OF MICROORGANISM GROWTH USING ARTIFICIAL INTELLIGENCE,,BACTEROMIC SP Z O O; Bacteromic Sp. z o.o,"DEBSKI PAWEL;  KUREK KRYSTIAN;  BORTKIEWICZ MICHAL;  SZELUGA JUSTYNA; DEBSKI, Pawel, ; KUREK, Krystian, ; BORTKIEWICZ, Michal, ; SZELUGA, Justyna",20210730,20220729,20251008,,,,,,2025,2022
,Use of remote virtual screening of patients with artificial intelligence (AI) and machine learning (ML) capability for initial screening of the patients for improving the efficiency of medical diagnosis and generation of treatment plans,"
                        ","THOMAS MAMMEN [US];  THOMAS ARUN MAMMEN [US]; Thomas Mammen, ; Thomas Arun Mammen","THOMAS MAMMEN [US];  THOMAS ARUN MAMMEN [US]; Thomas, Mammen, ; Thomas, Arun Mammen",20241029,20241029,20251007,,,,,,2025,2024
,Artificial intelligence system for anomalous activity detection using static and dynamic covariates,"
                        ","AMAZON TECH INC [US]; Amazon Technologies, Inc","NEAGU MATEI STEFAN [RO];  VOINEA DANIEL [RO];  IONESCU CONSTANTIN HARALAMBIE [RO];  SIMIONESCU CRISTINA [RO]; Neagu, Matei Stefan, ; Voinea, Daniel, ; Ionescu, Constantin Haralambie, ; Simionescu, Cristina",20201207,20201207,20251007,,,,,,2025,2020
,Systems and methods for mixed reality (mr) and artificial intelligence (ai)-enhanced fire investigation,"
                        ",TRAVELERS INDEMNITY CO [US]; The Travelers Indemnity Company,"SCANLON RYAN M [US];  ROY DOUGLAS L [US];  SWENGEL REYER D [US];  MALONE RYAN M [US];  LIM PEE T [US];  SKENANDORE KEIRA R [US]; Scanlon, Ryan M, ; Roy, Douglas L, ; Swengel, Reyer D, ; Malone, Ryan M, ; Lim, Pee T, ; Skenandore, Keira R",20231107,20231107,20251007,,,,,,2025,2023
,System and method for grounding outputs in tabular generative artificial intelligence,"
                        ","JPMORGAN CHASE BANK NA [US]; JPMorgan Chase Bank, N.A","BRUGERE IVAN [US];  KARIYAPPA SANJAY [US];  SHARMA SHUBHAM [US];  LECUE FREDDY [US];  NGUYEN GIANG [US]; Brugere, Ivan, ; Kariyappa, Sanjay, ; Sharma, Shubham, ; Lecue, Freddy, ; Nguyen, Giang",20241031,20241031,20251007,,,,,,2025,2024
,ARTIFICIAL INTELLIGENCE ENABLED DISEASE PROFILING,"
                        ","MASSACHUSETTS GEN HOSPITAL [US];  BROAD INST INC [US];  BETH ISRAEL DEACONESS MEDICAL CT INC [US]; The General Hospital Corporation, ; The Broad Institute, Inc, ; Beth Israel Deaconess Medical Center, Inc","ELLINOR PATRICK T [US];  LUBITZ STEVEN [US];  HO JENNIFER [US];  FRIEDMAN SAMUEL F [US];  KHURSHID SHAAN [US];  BATRA PUNEET [US]; Ellinor, Patrick T, ; Lubitz, Steven, ; Ho, Jennifer, ; Friedman, Samuel F, ; Khurshid, Shaan, ; Batra, Puneet",20240403,20250403,20251009,,,,,,2025,2025
,"ARTIFICIAL INTELLIGENCE-BASED IMAGE GENERATION METHOD AND APPARATUS, ELECTRONIC DEVICE, COMPUTER-READABLE STORAGE MEDIUM, AND COMPUTER PROGRAM PRODUCT","
                        ",TENCENT TECH SHENZHEN CO LTD [CN]; TENCENT TECHNOLOGY (SHENZHEN) COMPANY LIMITED,"WANG ZHOUXIA [CN];  WANG XINTAO [CN];  XIE LIANGBIN [CN];  QI ZHONGANG [CN];  SHAN YING [CN];  LUO PING [CN]; WANG, Zhouxia, ; WANG, Xintao, ; XIE, Liangbin, ; QI, Zhongang, ; SHAN, Ying, ; LUO, Ping",20230705,20250618,20251009,,,,,,2025,2025
,INTEGRATED MULTIMODAL ARTIFICIAL INTELLIGENCE FRAMEWORK FOR AUTOMATED PROVISIONING SYSTEMS,"
                        ",BANK OF AMERICA [US]; BANK OF AMERICA CORPORATION,"DANDE PRATAP [US];  NYAMWANGE ELVIS [US];  KUNCHA SARVESHWAR [US]; Dande, Pratap, ; Nyamwange, Elvis, ; Kuncha, Sarveshwar",20240405,20240405,20251009,,,,,,2025,2024
,"APPARATUSES, METHODS, AND COMPUTER PROGRAM PRODUCTS FOR GENERATING CLASSIFICATIONS FOR A SERVICE MESSAGE VIA MULTIPLE ARTIFICIAL INTELLIGENCE MODELS","
                        ","ATLASSIAN PTY LTD [AU];  ATLASSIAN US INC [US]; ATLASSIAN PTY, LTD, ; ATLASSIAN US, INC","ZHAO DEYANG [US];  SHA ZHOU [US]; Zhao, Deyang, ; Sha, Zhou",20220930,20250624,20251009,,,,,,2025,2025
,GENERATIVE ARTIFICIAL INTELLIGENCE,"
                        ",GOOGLE LLC [US]; Google LLC,"GONG HAIFENG [US];  LI XIAOHANG [US];  TERWILLIGER SAMUEL FORREST [US]; Gong, Haifeng, ; Li, Xiaohang, ; Terwilliger, Samuel Forrest",20240408,20240408,20251009,,,,,,2025,2024
,METHOD FOR BUILDING DATABASE FOR RETRIEVAL-AUGMENTED GENERATION INTERLINKED WITH GENERATIVE ARTIFICIAL INTELLIGENCE AND APPARATUS THEREFOR,"
                        ","SAMSUNG SDS CO LTD [KR]; SAMSUNG SDS CO., LTD","HAN WOOSUN [KR];  BAEK SEUNGMIN [KR];  YOO TAE HWANG [KR];  PARK JOOKYUNG [KR];  JEONG YUSEOK [KR]; HAN, Woosun, ; BAEK, Seungmin, ; YOO, Tae Hwang, ; PARK, Jookyung, ; JEONG, Yuseok",20240403,20250403,20251009,,,,,,2025,2025
,TECHNIQUES FOR MANAGING ARTIFICIAL INTELLIGENCE (AI) MODELS FOR SMART HOME SYSTEMS,"
                        ",APPLE INC [US]; Apple Inc,"JAIN AKSHATH R [US];  NGUYEN JANE L [US]; JAIN, Akshath R, ; NGUYEN, Jane L",20240408,20250324,20251009,,,,,,2025,2025
,ARTIFICIAL INTELLIGENCE-BASED TOOL FOR MYOCARDIAL BLOOD FLOW PARAMETRIC MAPPING TO DIAGNOSE CORONARY ARTERY DISEASE WITH 82RB POSITRON EMISSION TOMOGRAPHY,"
                        ",JUBILANT DRAXIMAGE INC [CA]; Jubilant Draximage Inc,"MOULTON ERIC JAMES [CA];  DEKEMP ROBERT A [CA];  HUNTER CHAD ROGER RONALD NICHOLAS [CA]; Moulton, Eric James, ; DeKemp, Robert A, ; Hunter, Chad Roger Ronald Nicholas",20220906,20250621,20251009,,,,,,2025,2025
,SYSTEMS AND METHODS FOR FORECASTING NICHE MARKET TRENDS USING ARTIFICIAL INTELLIGENCE AND SOCIAL MEDIA DATA,"
                        ","WISSEE INC [US]; Wissee, Inc","MAO HUINA [US];  SHUAI XIN [US]; Mao, Huina, ; Shuai, Xin",20240408,20250407,20251009,,,,,,2025,2025
,ECHOCARDIOGRAPHIC ESTIMATION OF RIGHT ATRIAL PRESSURE USING A LIGHTWEIGHT AND OPEN-WORLD ARTIFICIAL INTELLIGENCE SYSTEM,"
                        ","THE US SECRETARY DEPARTMENT OF HEALTH AND HUMAN SERICE [US]; The united States of America,as represented by the Secretary, Department of Health and Human Serice","ALZAMZMI GHADH A [US];  ANTANI SAMEER K [US];  HSU LI-YUEH [US];  SACHDEV VANDANA [US];  RAJARAMAN SIVARAMA KRISHNAN [US]; Alzamzmi, Ghadh A, ; Antani, Sameer K, ; Hsu, Li-Yueh, ; Sachdev, Vandana, ; Rajaraman, Sivarama Krishnan",20220609,20230609,20251009,,,,,,2025,2023
,SYSTEM AND METHOD FOR PREDICTING EVENT MARKET ODDS OUTCOMES USING CROWD-SOURCED SENTIMENT AND CUSTOM ODDS WITH ARTIFICIAL INTELLIGENCE,"
                        ",NEESAN LABS LLC [US]; Neesan Labs LLC,"NEESAN RAMSEN [US]; Neesan, Ramsen",20240409,20250409,20251009,,,,,,2025,2025
,ARTIFICIAL INTELLIGENCE CHATBOT,"
                        ",HONEYWELL INT INC [US]; Honeywell International Inc,"IYER AJAY RAMA [IN];  RAI AMAN [IN];  BALAKRISHNA BANUPRAKASH [IN];  SANDEEP DEEPIKA [IN];  DUGAR DEVANSHU [IN];  MENDEZ RENIL AUSTIN [IN];  SANKARAN SHRIRAM [IN];  SARDAR SOUVIK [IN]; Iyer, Ajay Rama, ; Rai, Aman, ; Balakrishna, Banuprakash, ; Sandeep, Deepika, ; Dugar, Devanshu, ; Mendez, Renil Austin, ; Sankaran, Shriram, ; Sardar, Souvik",20240405,20250404,20251009,,,,,,2025,2025
,METHOD FOR RETRIEVAL-AUGMENTED GENERATION INTERACTING WITH GENERATIVE ARTIFICIAL INTELLIGENCE AND APPARATUS THEREFOR,"
                        ","SAMSUNG SDS CO LTD [KR]; SAMSUNG SDS CO., LTD","BAEK SEUNGMIN [KR];  YOO TAE HWANG [KR]; BAEK, Seungmin, ; YOO, Tae Hwang",20240403,20250403,20251009,,,,,,2025,2025
,SYSTEMS AND METHODS FOR MITIGATING THE OVERFITTING OF ARTIFICIAL INTELLIGENCE MODELS,"
                        ","WELLS FARGO BANK NA [US]; Wells Fargo Bank, N.A","KHABIRI SHAHNAM [US];  GAO JIA [US]; Khabiri, Shahnam, ; Gao, Jia",20240409,20240409,20251009,,,,,,2025,2024
,EVALUATING EXPLAINABLE ARTIFICIAL INTELLIGENCE MODELS AND AN ARCHITECTURE FOR AN ENSEMBLE EXPLAINABLE MODEL SELECTION,"
                        ","U S BANCORP NAT ASSOCIATION [US]; U.S. Bancorp, National Association","MATHEWS SHERIN [US];  ASSEFA SAMUEL [US]; Mathews, Sherin, ; Assefa, Samuel",20240409,20240409,20251009,,,,,,2025,2024
,FRAUD ANALYSIS USING MACHINE LEARNING AND GENERATIVE ARTIFICIAL INTELLIGENCE,"
                        ",ACTIMIZE LTD [IL]; ACTIMIZE LTD,"CHATTOPADHYAY SABERI [US];  LAO RALPH [US];  LOPEZ DEBORAH [US]; CHATTOPADHYAY, Saberi, ; LAO, Ralph, ; LOPEZ, Deborah",20240409,20240409,20251009,,,,,,2025,2024
,ARTIFICIAL INTELLIGENCE AUTOMATIC INTERVENTION SYSTEM AND METHOD OF USE THEREOF,"
                        ",DEEP SENTINEL CORP [US]; DEEP SENTINEL CORP,"SELINGER DAVID [US];  BORYS TOMASZ [US];  BRUMBAUGH DAVID [US];  DEVINCK MARC [US];  NATARAJ PRAVEEN [US]; SELINGER, David, ; BORYS, Tomasz, ; BRUMBAUGH, David, ; DEVINCK, Marc, ; NATARAJ, Praveen",20240408,20250408,20251009,,,,,,2025,2025
,METHODS AND SYSTEMS FOR DETECTING BULLYING IN REAL TIME USING ARTIFICIAL INTELLIGENCE,"
                        ",TYCO FIRE & SECURITY GMBH [CH]; Tyco Fire & Security GmbH,"XU KELVIN H [US]; XU, Kelvin H",20220621,20230519,20251009,,,,,,2025,2023
,ARTIFICIAL INTELLIGENCE AUTOMATIC INTERVENTION SYSTEM AND METHOD OF USE THEREOF,"
                        ",DEEP SENTINEL CORP [US]; DEEP SENTINEL CORP,"SELINGER DAVID [US];  BORYS TOMASZ [US];  BRUMBAUGH DAVID [US];  DEVINCK MARC [US];  NATARAJ PRAVEEN [US]; SELINGER, David, ; BORYS, Tomasz, ; BRUMBAUGH, David, ; DEVINCK, Marc, ; NATARAJ, Praveen",20240408,20250408,20251009,,,,,,2025,2025
,EXPLAINABLE ARTIFICIAL INTELLIGENCE APPARATUS AND METHOD FOR ANALYZING MODEL THEREOF,"
                        ",KONAN TECH INC [KR]; Konan Technology Inc,"KIM KYEONGSOO [KR];  JEONG JAEHYEOK [KR];  LEE JUHYUN [KR];  LEE HYEONGDO [KR];  KANG HYUNSU [KR]; KIM, Kyeongsoo, ; JEONG, Jaehyeok, ; LEE, Juhyun, ; LEE, Hyeongdo, ; KANG, Hyunsu",20240405,20240509,20251009,,,,,,2025,2024
,Large Language Model-Enabled Artificial Intelligence-Based Virtual Interactive Reading Assistant,"
                        ",IBM [US]; International Business Machines Corporation,"NOREL RAQUEL [US];  WANG CHEN [US];  AGURTO RIOS CARLA PAOLA [US];  WEN BO [US]; Norel, Raquel, ; Wang, Chen, ; Agurto Rios, Carla Paola, ; Wen, Bo",20240408,20240408,20251009,,,,,,2025,2024
,ARTIFICIAL INTELLIGENCE COMPUTING DEVICE FOR IMPROVING BUSINESS PERFORMANCE,"
                        ",MANSSON NIGEL [US]; Mansson Nigel,"MANSSON NIGEL [US]; Mansson, Nigel",20240403,20240403,20251009,,,,,,2025,2024
,GENERATIVE ARTIFICIAL INTELLIGENCE (AI) CONTENT STRATEGY,"
                        ",ADOBE INC [US]; Adobe Inc,"XIAO CHANG [US];  COURTOIS ZEUS [US];  SURANGE SONALI [US];  HANSON-REGALADO JACOB BENJAMIN [US];  KOH EUNYEE [US];  MILLER GAVIN STUART PETER [US]; Xiao, Chang, ; Courtois, Zeus, ; Surange, Sonali, ; Hanson-Regalado, Jacob Benjamin, ; Koh, Eunyee, ; Miller, Gavin Stuart Peter",20240403,20240403,20251009,,,,,,2025,2024
,ANALYSIS OF STRUCTURED DATA IN CHAINS OF REPEATABLE ACTIONS WITHIN AN ARTIFICIAL INTELLIGENCE-BASED AGENT ENVIRONMENT,"
                        ","AGBLOX INC [US]; AGBLOX, INC","FEEHAN SEAN [CA];  BLAIR THOMAS N [US];  LUKASHCHUK MYKOLA [NL];  GRYTSAI IURII [CA];  RAKHMINOV HUGHES KIRILL [US];  BURLET GREGORY [CA];  LAZARIS SPYROS J [US]; FEEHAN, SEAN, ; BLAIR, THOMAS N, ; LUKASHCHUK, MYKOLA, ; GRYTSAI, IURII, ; RAKHMINOV HUGHES, KIRILL, ; BURLET, GREGORY, ; LAZARIS, SPYROS J",20240405,20250407,20251009,,,,,,2025,2025
,System and Method for Enhancing Generative Artificial Intelligence (AI) Model-Based Document Search with Image Retrieval,"
                        ",DELL PRODUCTS LP [US]; Dell Products L.P,"DAR SHAUL [IL];  ZELDICH MICHAEL [US];  KANAGOVI RAMAKANTH [IN];  SWAMINATHAN GUHESH [IN];  KUMAR RAJAN [IN]; Dar, Shaul, ; Zeldich, Michael, ; Kanagovi, Ramakanth, ; Swaminathan, Guhesh, ; Kumar, Rajan",20240405,20240405,20251009,,,,,,2025,2024
,DEEP LINKING USING GENERATIVE ARTIFICIAL INTELLIGENCE,"
                        ",GOOGLE LLC [US]; Google LLC,"HAGLER MAXWELL RYAN [US]; Hagler, Maxwell Ryan",20230721,20250616,20251009,,,,,,2025,2025
,ARTIFICIAL INTELLIGENCE BEST FRIEND SYSTEM WITH ENHANCED MEMORY MODULE AND SELECTABLE AVATARS,"
                        ",MARKS MICHAEL B [US]; Marks Michael B,"MARKS MICHAEL B [US]; Marks, Michael B",20240319,20250312,20251009,,,,,,2025,2025
,METHOD AND APPARATUS FOR AUTOMATIC DESIGN CONSTRAINT GENERATION FOR CHIP IP USING GENERATIVE ARTIFICIAL INTELLIGENCE,"
                        ",MARVELL ASIA PTE LTD [SG]; Marvell Asia Pte Ltd,"TRINKO MECHLER JEANNE [US];  FONG PATRICIA CHONG [US]; Trinko Mechler, Jeanne, ; Fong, Patricia Chong",20240405,20250130,20251009,,,,,,2025,2025
,ENHANCING ARTIFICIAL INTELLIGENCE RESPONSES WITH CONTEXTUAL USAGE INSIGHTS,"
                        ",ADOBE INC [US]; Adobe Inc,"MAHARAJ AKASH VIVEK [US];  MUPPALA VAISHNAVI [US];  VAITHYANATHAN SHIVAKUMAR [US];  GARG MANAS [US];  RUSSELL KENNETH GEORGE [US];  DASGUPTA ISHITA [US];  RAO ANUP BANDIGADI [US];  PEJCIC ALEKSANDER [US]; MAHARAJ, Akash Vivek, ; MUPPALA, Vaishnavi, ; VAITHYANATHAN, Shivakumar, ; GARG, Manas, ; RUSSELL, Kenneth George, ; DASGUPTA, Ishita, ; RAO, Anup Bandigadi, ; PEJCIC, Aleksander",20240404,20240404,20251009,,,,,,2025,2024
